"use strict";(self.webpackChunkdocs=self.webpackChunkdocs||[]).push([[1200],{27625:e=>{e.exports=JSON.parse('{"archive":{"blogPosts":[{"id":"/2026/01/20/version-2.4.0","metadata":{"permalink":"/changelog/2026/01/20/version-2.4.0","source":"@site/changelog/2026-01-20-version-2.4.0.md","title":"Version 2.4.0","description":"Version 2.4.0","date":"2026-01-20T00:00:00.000Z","tags":[{"inline":true,"label":"release","permalink":"/changelog/tags/release"}],"hasTruncateMarker":false,"authors":[{"name":"Sleakops Team","socials":{},"key":null,"page":null}],"frontMatter":{"title":"Version 2.4.0","authors":[{"name":"Sleakops Team"}],"tags":["release"]},"unlisted":false,"nextItem":{"title":"Version 2.3.2","permalink":"/changelog/v2-3-2"}},"content":"## **Version 2.4.0**\\n\\n\ud83d\uddd3\ufe0f\xa0_01/08/2026_\\n\\n**\ud83d\ude80 New Features:**\\n\\n- **Workload Auto-Diagnostics:**\xa0With the help of AI, you can now quickly and easily discover what\'s happening with your Workloads. With just one click from the console, you\'ll get a complete diagnosis.\\n- **Grace Period for Workloads:**\xa0Support for configuring grace period in Workloads.\\n- **Cost Tags Notifications:**\xa0Added notifications for configuring cost tags.\\n- **Cascade Deletion:**\xa0Improvements in cascade deletion flow with active Dependencies.\\n- **File-based Variable Groups:**\xa0Improvements in the Variable Groups form for file types.\\n- **Project Selector:**\xa0Improvements in forms with Project selector.\\n- **Activity Logs Navigation:**\xa0Added links to navigate between Activity Logs and resources.\\n- **Sidebar:**\xa0Visual improvements to the sidebar.\\n- **Billing Screen:**\xa0Improvements to the billing screen.\\n- **Domain Editing:**\xa0Ability to modify domains in existing Environments.\\n- **Variable Names:**\xa0Handling of variable name length in Variable Groups.\\n- **Environment Names:**\xa0Adjustments to default Environment names.\\n- **Dependency Monitoring:**\xa0Improvements in Dependency monitoring.\\n- **Small Resolutions:**\xa0UI improvements for low resolutions or small screens.\\n- **Modified Variables:**\xa0Improvements in the Variable Groups form to mark which variables were modified.\\n- **Target Port in Web Services:**\xa0Support for configuring targetPort for services in Web Services.\\n\\n**\ud83d\udc1e Bug Fixes:**\\n\\n- **Environment Names:**\xa0Handling of Environment name length.\\n- **Persistent Filters:**\xa0Project and Environment filters now persist between screens.\\n- **Project Icons:**\xa0Improved icons for Projects.\\n- **Addons with Custom Attributes:**\xa0Fixed editing of addons with custom attributes.\\n- **RDS Replicas:**\xa0Validation of RDS replica length.\\n- **Web Services URL:**\xa0Fixed URL auto-generation when editing a Web Service.\\n- **Project Selector:**\xa0Fixed visibility of the Project selector.\\n- **Nodepool Forms:**\xa0Fixed errors in Nodepool editing and creation forms.\\n- **State Transition:**\xa0Fixed transition from pending to completed state.\\n- **SSL Certificate:**\xa0Fixed alerts for SSL certificate validation.\\n- **Cloning with Versions:**\xa0Fixed cloning with Dependency versions.\\n- **Notification Emails:**\xa0Fixed visual errors in notification emails.\\n- **Cloning URL:**\xa0Fixed Web Services URL in cloning flow.\\n- **Delete Project with RDS:**\xa0Fixed deletion of a Project with an RDS that has deletion protection enabled."},{"id":"v2-3-2","metadata":{"permalink":"/changelog/v2-3-2","source":"@site/changelog/2025-12-19-V2.3.2.md","title":"Version 2.3.2","description":"New Features","date":"2025-12-19T00:00:00.000Z","tags":[{"inline":true,"label":"release","permalink":"/changelog/tags/release"}],"hasTruncateMarker":true,"authors":[],"frontMatter":{"title":"Version 2.3.2","slug":"v2-3-2","date":"2025-12-19T00:00:00.000Z","tags":["release"]},"unlisted":false,"prevItem":{"title":"Version 2.4.0","permalink":"/changelog/2026/01/20/version-2.4.0"},"nextItem":{"title":"Version 2.3.1","permalink":"/changelog/v2-3-1"}},"content":"\x3c!--truncate--\x3e\\n\\n## New Features\\n\\n- **SleakOps CLI:** Improvements and new features, including the ability to open a Workload shell locally.\\n- **S3 with CloudFront:** Improvements in S3 integration with CloudFront.\\n- **Python in Lambdas:** Updated Python versions for Lambdas.\\n- **Charts in Projects:** Improvements to the chart configuration screen in Projects.\\n- **Subnet Tags:** Improvements in subnet tag handling for autodiscovery.\\n- **DB Restoration:** Improvements in the database restoration flow from a snapshot.\\n- **Ingress in Web Services:** Support for configuring URL and ingress annotations in Web Services.\\n- **API Performance:** Optimization of API performance.\\n- **Domain Errors:** Improvements in domain error handling.\\n- **Addon Buttons:** Visual improvements to addon buttons.\\n- **Notifications:** Visual improvements when displaying notifications.\\n- **Button Options:** Visual improvements to button options (settings, copy, etc.).\\n- **RDS Versions:** Updated available RDS versions.\\n- **Infrastructure Modules:** Optimization of execution times for infrastructure modules.\\n\\n## Bug Fixes:\\n\\n- **Role Deletion:** Handling of role deletion when deleting a Project.\\n- **Multi-Provider Billing:** Fixed billing screen with multiple providers.\\n- **Registration and Login:** Handling of registration and login flow with different subscription states.\\n- **Nodepool Form:** Error handling in the Nodepool form.\\n- **Account Switching:** Error handling when switching between accounts.\\n- **Variable Characters:** Handling of invalid characters in variable names in Variable Groups.\\n- **Cluster Access:** Handling of Cluster access for different user types.\\n- **VPN Access:** Error handling when obtaining VPN access for different user types.\\n- **Listing Texts:** Fixed texts in listings and forms.\\n- **AWS Connection:** Fixed texts in the step-by-step guide for connecting with AWS.\\n- **Pending Deployments:** Alert indicator for deployments pending approval.\\n- **Postgres Upgrade:** Error handling in PostgreSQL upgrade from 14 to 17.\\n- **RDS Security Group:** Fixed security group for public and private RDS replicas.\\n- **Support Chat:** Fixed delegation in support chat."},{"id":"v2-3-1","metadata":{"permalink":"/changelog/v2-3-1","source":"@site/changelog/2025-12-01-V2.3.1.md","title":"Version 2.3.1","description":"12/01/2025","date":"2025-12-01T00:00:00.000Z","tags":[{"inline":true,"label":"release","permalink":"/changelog/tags/release"}],"hasTruncateMarker":true,"authors":[],"frontMatter":{"title":"Version 2.3.1","slug":"v2-3-1","date":"2025-12-01T00:00:00.000Z","tags":["release"]},"unlisted":false,"prevItem":{"title":"Version 2.3.2","permalink":"/changelog/v2-3-2"},"nextItem":{"title":"Version 2.3.0","permalink":"/changelog/v2-3-0"}},"content":"\x3c!--truncate--\x3e\\n\\n12/01/2025\\n\\n## New Features\\n\\n- **Image Analysis in Support:** Support for image analysis in the support bot.\\n- **Documentation:** New documentation for Dockertron and chart management.\\n- **Custom Values in Addons:** Ability to use custom values when installing an addon.\\n- **Nodegroup Change:** Ability to change the nodegroup of non-production clusters.\\n- **Support Flow:** Conversation flow for support between bot and human.\\n\\n## Bug Fixes\\n\\n- **Confirmation Modals:** Fixed position of deletion confirmation modals.\\n- **Builds Table:** Fixed data and column errors in the builds table.\\n- **Dashboard Notifications:** Fixed notification messages in the dashboard.\\n- **Workload Names:** Adjusted name sizes for Workloads.\\n- **Chart Dependency:** Fixed chart dependency flow.\\n- **Console Alerts:** Fixed notification alerts in the console."},{"id":"v2-3-0","metadata":{"permalink":"/changelog/v2-3-0","source":"@site/changelog/2025-11-18-V2.3.0.md","title":"Version 2.3.0","description":"11/18/2025","date":"2025-11-18T00:00:00.000Z","tags":[{"inline":true,"label":"release","permalink":"/changelog/tags/release"}],"hasTruncateMarker":true,"authors":[],"frontMatter":{"title":"Version 2.3.0","slug":"v2-3-0","date":"2025-11-18T00:00:00.000Z","tags":["release"]},"unlisted":false,"prevItem":{"title":"Version 2.3.1","permalink":"/changelog/v2-3-1"},"nextItem":{"title":"Version 2.2.0","permalink":"/changelog/v2-2-0"}},"content":"\x3c!--truncate--\x3e\\n\\n11/18/2025\\n\\n## New Features\\n\\n- **Environment Cloning:** New function to clone Environments.\\n- **Project Cloning:** New function to clone Projects.\\n- **Dependency Cloning:** New function to clone Dependencies.\\n- **Workload Cloning:** New function to clone Workloads.\\n- **Variable Group Cloning:** New function to clone Variable Groups.\\n- **Cluster Monitoring Filters:** Added filters for navigating Cluster events in Cluster Monitoring.\\n- **Variable Group Search:** Ability to search Variable Groups by internal key names from the general search.\\n\\n## Bug Fixes\\n\\n- **Selected Account:** The selected account now persists when switching users.\\n- **Web Services Shutdown:** Improved Web Services shutdown."},{"id":"v2-2-0","metadata":{"permalink":"/changelog/v2-2-0","source":"@site/changelog/2025-11-13-V2.2.0.md","title":"Version 2.2.0","description":"10/25/2025","date":"2025-11-13T00:00:00.000Z","tags":[{"inline":true,"label":"release","permalink":"/changelog/tags/release"}],"hasTruncateMarker":true,"authors":[],"frontMatter":{"title":"Version 2.2.0","slug":"v2-2-0","date":"2025-11-13T00:00:00.000Z","tags":["release"]},"unlisted":false,"prevItem":{"title":"Version 2.3.0","permalink":"/changelog/v2-3-0"},"nextItem":{"title":"Version 2.1.0","permalink":"/changelog/v2-1-0"}},"content":"\x3c!--truncate--\x3e\\n\\n10/25/2025\\n\\n## New Features\\n\\n- **Code Viewer:** New component for viewing code within the console.\\n\\n## Bug Fixes\\n\\n- **Deleted Users:** Fixed errors with deleted users.\\n- **Update Branches:** Fixed the flow for updating branches in Project.\\n- **Incomplete Information:** Fixed the flow when Project information is incomplete.\\n- **Extra Policies:** Fixed the flow for configuring extra policies in Project."},{"id":"v2-1-0","metadata":{"permalink":"/changelog/v2-1-0","source":"@site/changelog/2025-11-10-V2.1.0.md","title":"Version 2.1.0","description":"11/05/2025","date":"2025-11-10T00:00:00.000Z","tags":[{"inline":true,"label":"release","permalink":"/changelog/tags/release"}],"hasTruncateMarker":true,"authors":[],"frontMatter":{"title":"Version 2.1.0","slug":"v2-1-0","date":"2025-11-10T00:00:00.000Z","tags":["release"]},"unlisted":false,"prevItem":{"title":"Version 2.2.0","permalink":"/changelog/v2-2-0"},"nextItem":{"title":"Version 2.0.1","permalink":"/changelog/v2-0-1"}},"content":"\x3c!--truncate--\x3e\\n\\n11/05/2025\\n\\n## New Features\\n\\n- **Cluster Update:** Support for Cluster update from 1.31 to 1.32.\\n- **Dependency Tour:** New guided tour for the Dependency screen.\\n- **Workload Tour:** New guided tour for the Workload screen.\\n- **Variable Group Tour:** New guided tour for the Variable Group screen.\\n- **Cluster Tour:** New guided tour for the Cluster screen.\\n- **Project Tour:** New guided tour for the Project screen.\\n- **Cluster Update Optimization:** Optimization of Cluster update tasks.\\n- **Screen Loading:** Improvements in loading drawers and secondary screens.\\n- **Schedule Update:** New flow to schedule Cluster updates.\\n- **Onboarding:** New onboarding flow for new users.\\n- **Nodepool Configuration:** Support for more Nodepool configuration parameters (instance types, fallbacks, etc.).\\n- **Upgrade Monitoring:** New service monitoring flow during Cluster upgrade with error reporting.\\n- **Build Logs:** Improvements in build logs with more context.\\n\\n## Bug Fixes\\n\\n- **SSL Certificate for S3:** Fixed SSL certificate errors for S3 with CloudFront.\\n- **Activity Logs:** Fixed names in some Activity Logs.\\n- **User Creation:** Fixed errors in the user creation flow.\\n- **Support Tickets:** Fixed support ticket status.\\n- **Build with CLI:** Fixed parameters when building using the CLI.\\n- **Nightly Shutdown:** Fixed Cluster status with nightly shutdown enabled.\\n- **Screen Resolutions:** Adjustments for some resolutions on the main console screen.\\n- **Delete Web Services:** Fixed errors when deleting a Web Service from the table."},{"id":"v2-0-1","metadata":{"permalink":"/changelog/v2-0-1","source":"@site/changelog/2025-10-15-V2.0.1.md","title":"Version 2.0.1","description":"10/15/2025","date":"2025-10-15T00:00:00.000Z","tags":[{"inline":true,"label":"release","permalink":"/changelog/tags/release"}],"hasTruncateMarker":true,"authors":[],"frontMatter":{"title":"Version 2.0.1","slug":"v2-0-1","date":"2025-10-15T00:00:00.000Z","tags":["release"]},"unlisted":false,"prevItem":{"title":"Version 2.1.0","permalink":"/changelog/v2-1-0"},"nextItem":{"title":"Version 2.0.0","permalink":"/changelog/v2-0-0"}},"content":"\x3c!--truncate--\x3e\\n\\n10/15/2025\\n\\n## New Features\\n\\n- **Builds and Deploys Table:** Improvements to the data shown in the builds and deploys table.\\n\\n## Bug Fixes\\n\\n- **Nightly Shutdown Cron:** Fixed visualization of the nightly shutdown cron.\\n- **Cluster Status:** Fixed Cluster status update while updating.\\n- **Long Notifications:** Fixed visualization of long notifications.\\n- **Third-Party VPN:** Fixed VPN access for third parties.\\n- **Deploy Cancellation:** Fixed deploy cancellation flow.\\n- **Provider Creation:** Fixed text hierarchies in the Provider creation flow.\\n- **Missing Information:** Fixed redirection in the missing information flow for Project.\\n- **Viewer User:** Fixed navigation for viewer users.\\n- **Light Mode Toggles:** Improved toggle visibility in light mode.\\n- **Dependency MQ Password:** Fixed password auto-generation for Dependency MQ.\\n- **Icon Loading:** Improvements in icon loading.\\n- **Transition Screens:** Fixed transition screens during data loading.\\n- **Project Console Tables:** Improved table visualization on the \\"Project Console\\" screen.\\n- **Infrastructure Errors:** Fixed error messages when infrastructure module execution fails.\\n- **Mobile Account Selector:** Support for account selector on mobile devices."},{"id":"v2-0-0","metadata":{"permalink":"/changelog/v2-0-0","source":"@site/changelog/2025-10-01-V2.0.0.md","title":"Version 2.0.0","description":"10/01/2025","date":"2025-10-01T00:00:00.000Z","tags":[{"inline":true,"label":"release","permalink":"/changelog/tags/release"}],"hasTruncateMarker":true,"authors":[],"frontMatter":{"title":"Version 2.0.0","slug":"v2-0-0","date":"2025-10-01T00:00:00.000Z","tags":["release"]},"unlisted":false,"prevItem":{"title":"Version 2.0.1","permalink":"/changelog/v2-0-1"},"nextItem":{"title":"Version 1.7.16","permalink":"/changelog/v1-7-16"}},"content":"\x3c!--truncate--\x3e\\n\\n10/01/2025\\n\\n## New Features\\n\\n- **Full Console Redesign:** Modernized UI for a cleaner, more intuitive experience.\\n- **Light Theme Support:** Complete support for light mode.\\n- **Support Bot:** Automated responses for common support questions.\\n- **Comprehensive Documentation:** Expanded guides covering all features.\\n- **Update lambdas:** Update python versions for lambdas.\\n- **Project Chart:** Promoted to stable.\\n- **Project Access:** Promoted to stable.\\n- **Dependency Aurora MySQL:** Promoted to stable.\\n- **Dependency Oracle:** Promoted to stable.\\n- **Dependency MariaDB:** Promoted to stable.\\n- **Dependency Aurora PostgreSQL:** Promoted to stable.\\n- **Dependency Editing:** Ability to edit existing dependencies.\\n- **Dockertron (beta):** AI-powered automatic dockerization.\\n- **Builds cancel:** Could cancel pending builds.\\n- **New MSK Dependency:** Support for Kafka via AWS MSK.\\n- **Enhanced Webservices:** Configure custom ingress annotations and optional healthchecks.\\n- **Advanced Nodepools:** New fallback strategies and instance mix (reserved, spot, on-demand) for better cost and performance control.\\n\\n## Bug Fixes\\n\\n- **GitLab self-hosted:** Fixed URL validation.\\n- **Cluster deletion:** Improved cascading deletion handling."},{"id":"v1-7-16","metadata":{"permalink":"/changelog/v1-7-16","source":"@site/changelog/2025-07-21-V1.7.16.md","title":"Version 1.7.16","description":"21/07/2025","date":"2025-07-21T00:00:00.000Z","tags":[{"inline":true,"label":"release","permalink":"/changelog/tags/release"}],"hasTruncateMarker":true,"authors":[],"frontMatter":{"title":"Version 1.7.16","slug":"v1-7-16","date":"2025-07-21T00:00:00.000Z","tags":["release"]},"unlisted":false,"prevItem":{"title":"Version 2.0.0","permalink":"/changelog/v2-0-0"},"nextItem":{"title":"Version 1.7.15","permalink":"/changelog/v1-7-15"}},"content":"\x3c!--truncate--\x3e\\n\\n21/07/2025\\n\\n## New Features\\n\\n- **Projects with Public Repositories:** You can now create and manage projects linked to public repositories.\\n- **Exclude Builds from Metrics:** Builds can be excluded from the Grafana metrics dashboard for more accurate reporting.\\n\\n## Bug Fixes\\n\\n- **New Project Deployments:** Fixed issues preventing successful deployment of newly created projects."},{"id":"v1-7-15","metadata":{"permalink":"/changelog/v1-7-15","source":"@site/changelog/2025-07-07-V1.7.15.md","title":"Version 1.7.15","description":"07/07/2025","date":"2025-07-07T00:00:00.000Z","tags":[{"inline":true,"label":"release","permalink":"/changelog/tags/release"}],"hasTruncateMarker":true,"authors":[],"frontMatter":{"title":"Version 1.7.15","slug":"v1-7-15","date":"2025-07-07T00:00:00.000Z","tags":["release"]},"unlisted":false,"prevItem":{"title":"Version 1.7.16","permalink":"/changelog/v1-7-16"},"nextItem":{"title":"Version 1.7.14","permalink":"/changelog/v1-7-14"}},"content":"\x3c!--truncate--\x3e\\n\\n07/07/2025\\n\\n## New Features\\n\\n- **Nodegroup Spot Resilience:** Spot nodegroups now prevent failures when no Spot instances are available.\\n- **File-based VariableGroups:** Added support for creating variablegroups of type file.\\n- **Agent Bot (beta):** Experimental agent bot released in beta.\\n\\n## Bug Fixes\\n\\n- **Dependent domain configuration:** Generate DNS records when parent domain already created.\\n- **Cluster status with nightly shutdown:** Fixed incorrect status display for clusters with nightly shutdown enabled.\\n- **VariableGroups filters:** Fiter by projects on variablegroups list\\n- **Delete cluster:** Fixed deletion cluster flow.\\n- **Support ticket status:** Fixed close support ticket status."},{"id":"v1-7-14","metadata":{"permalink":"/changelog/v1-7-14","source":"@site/changelog/2025-06-26-V1.7.14.md","title":"Version 1.7.14","description":"26/06/2025","date":"2025-06-26T00:00:00.000Z","tags":[{"inline":true,"label":"release","permalink":"/changelog/tags/release"}],"hasTruncateMarker":true,"authors":[],"frontMatter":{"title":"Version 1.7.14","slug":"v1-7-14","date":"2025-06-26T00:00:00.000Z","tags":["release"]},"unlisted":false,"prevItem":{"title":"Version 1.7.15","permalink":"/changelog/v1-7-15"},"nextItem":{"title":"Version 1.7.13","permalink":"/changelog/v1-7-13"}},"content":"\x3c!--truncate--\x3e\\n\\n26/06/2025\\n\\n## New Features\\n\\n- **State Transition Improvements:** Smoother state changes for cluster addons and forms.\\n- **Support with Images:** Users can now upload images in the support chat.\\n- **Jobs from Cronjobs or Existing Jobs:** Ability to launch a Job from an existing cronjob or Job.\\n- **Infrastructure Errors:** Improved parsing and display of infrastructure errors for easier troubleshooting.\\n\\n## Bug Fixes\\n\\n- **Duplicate Volumes:** Fixed issue when creating volumes with the same name.\\n- **Duplicate Users:** Prevented creation of users with the same email.\\n- **Duplicate Dependencies:** Blocked creation of dependencies with duplicate names.\\n- **Dependency Monitoring:** Fixed date range issues on the dependency monitoring screen."},{"id":"v1-7-13","metadata":{"permalink":"/changelog/v1-7-13","source":"@site/changelog/2025-06-02-V1.7.13.md","title":"Version 1.7.13","description":"02/06/2025","date":"2025-06-02T00:00:00.000Z","tags":[{"inline":true,"label":"release","permalink":"/changelog/tags/release"}],"hasTruncateMarker":true,"authors":[],"frontMatter":{"title":"Version 1.7.13","slug":"v1-7-13","date":"2025-06-02T00:00:00.000Z","tags":["release"]},"unlisted":false,"prevItem":{"title":"Version 1.7.14","permalink":"/changelog/v1-7-14"},"nextItem":{"title":"Version 1.7.12","permalink":"/changelog/v1-7-12"}},"content":"\x3c!--truncate--\x3e\\n\\n02/06/2025\\n\\n## New Features\\n\\n- **Dependency Monitoring:** Improved visualization and tracking of dependencies.\\n- **Service Control:** New toggle to turn webservices and workers on or off.\\n- **Builds with or without cache:** Option to run builds using cache or from scratch.\\n- **S3 Bucket Import with Versioning:** Added support for importing S3 Buckets with active versioning.\\n- **Variable Groups:** Enhanced interface for managing variable groups.\\n- **Dockerfile Validation:** New validations to ensure reliability of Dockerfiles.\\n\\n## Bug Fixes\\n\\n- **Job Logs:** Fixed broken log links for Jobs.\\n- **Branch Names:** Added support for branches with / in their names.\\n- **GitLab Pipelines:** Fixed issues affecting pipeline execution."},{"id":"v1-7-12","metadata":{"permalink":"/changelog/v1-7-12","source":"@site/changelog/2025-05-14-V1.7.12.md","title":"Version 1.7.12","description":"14/05/2025","date":"2025-05-14T00:00:00.000Z","tags":[{"inline":true,"label":"release","permalink":"/changelog/tags/release"}],"hasTruncateMarker":true,"authors":[],"frontMatter":{"title":"Version 1.7.12","slug":"v1-7-12","date":"2025-05-14T00:00:00.000Z","tags":["release"]},"unlisted":false,"prevItem":{"title":"Version 1.7.13","permalink":"/changelog/v1-7-13"},"nextItem":{"title":"Version 1.7.11","permalink":"/changelog/v1-7-11"}},"content":"\x3c!--truncate--\x3e\\n\\n14/05/2025\\n\\n## New Features\\n\\n- **New Support Flow:** Introduced a support chatbot and ticketing system to provide better traceability and faster response times.\\n- **Subscription & Plan Management:** Enhanced tools for managing subscriptions and service plans.\\n\\n## Bug Fixes\\n\\n- **Form Improvements:** General enhancements to form usability and validation.\\n- **Project Console:** UI/UX improvements in the project console screen."},{"id":"v1-7-11","metadata":{"permalink":"/changelog/v1-7-11","source":"@site/changelog/2025-04-24-V1.7.11.md","title":"Version 1.7.11","description":"24/04/2025","date":"2025-04-24T00:00:00.000Z","tags":[{"inline":true,"label":"release","permalink":"/changelog/tags/release"}],"hasTruncateMarker":true,"authors":[],"frontMatter":{"title":"Version 1.7.11","slug":"v1-7-11","date":"2025-04-24T00:00:00.000Z","tags":["release"]},"unlisted":false,"prevItem":{"title":"Version 1.7.12","permalink":"/changelog/v1-7-12"},"nextItem":{"title":"Version 1.7.10","permalink":"/changelog/v1-7-10"}},"content":"\x3c!--truncate--\x3e\\n\\n24/04/2025\\n\\n## New Features\\n\\n- **Kubernetes 1.31 & Karpenter 1.3:** SleakOps now provisions clusters on EKS 1.31 and upgrades the autoscaler to Karpenter 1.3.\\n- **Stronger Secret Management :** All secrets are now also stored encrypted in AWS Systems Manager Parameter Store, adding an extra layer of durability beyond the in-cluster copy.\\n\\n## Bug Fixes\\n\\n- **Dev-Cluster Workers:** Removed the PodDisruptionBudge  improving worker reliability in development clusters when the cluster had the scheduler shutdown enabled.\\n- **Builds:** Builds are no longer triggered for every minor project edit.\\n- **Deployments:** Switched deployments jobs away from Fargate; build logs are now persisted for easier troubleshooting.\\n- **Web Service Details:** Refined the service detail page for clearer visibility of endpoints, status, and metrics.\\n- **Kubecost Add-on:** Stability improvements"},{"id":"v1-7-10","metadata":{"permalink":"/changelog/v1-7-10","source":"@site/changelog/2025-04-01-V1.7.10.md","title":"Version 1.7.10","description":"01/04/2025","date":"2025-04-01T00:00:00.000Z","tags":[{"inline":true,"label":"release","permalink":"/changelog/tags/release"}],"hasTruncateMarker":true,"authors":[],"frontMatter":{"title":"Version 1.7.10","slug":"v1-7-10","date":"2025-04-01T00:00:00.000Z","tags":["release"]},"unlisted":false,"prevItem":{"title":"Version 1.7.11","permalink":"/changelog/v1-7-11"},"nextItem":{"title":"Version 1.7.9","permalink":"/changelog/v1-7-9"}},"content":"\x3c!--truncate--\x3e\\n\\n01/04/2025\\n\\n## New Features\\n\\n- **Enhanced Permission Control:** Projects can now have additional associated permissions, whether they are AWS IAM Policies or custom permissions.\\n- **Dependency Details:** The configuration details of each dependency are now displayed within its detail view.\\n- **Cluster Update Screen Improvements:** EKS Insights analysis is now included directly in SleakOps to streamline cluster updates.\\n- **Build & Project Enhancements:** Additional information during builds and improved project validation workflows.\\n\\n## Bug Fixes\\n\\n- **Improved Text Input:** Resolved issues affecting text inputs in forms.\\n- **Cluster Access Data:** Fixed a bug when retrieving cluster connection data under a different selected account.\\n- **Domain List Filters:** Added filters by account to the domain listing.\\n- **Nodepool List Improvements:** Refined visuals for the nodepool list view.\\n- **Add-on Installation Updates:** The list of add-ons now refreshes properly after installation.\\n- **Variable Group Editing:** Fixed an issue with editing variable groups.\\n- **Subscription Attachment:** Addressed a bug that prevented new subscriptions from attaching correctly.\\n- **Cost Forecast:** Fixed forecasting issues for better cost estimations."},{"id":"v1-7-9","metadata":{"permalink":"/changelog/v1-7-9","source":"@site/changelog/2025-02-17-V1.7.9.md","title":"Version 1.7.9","description":"17/02/2025","date":"2025-02-17T00:00:00.000Z","tags":[{"inline":true,"label":"release","permalink":"/changelog/tags/release"}],"hasTruncateMarker":true,"authors":[],"frontMatter":{"title":"Version 1.7.9","slug":"v1-7-9","date":"2025-02-17T00:00:00.000Z","tags":["release"]},"unlisted":false,"prevItem":{"title":"Version 1.7.10","permalink":"/changelog/v1-7-10"},"nextItem":{"title":"Version 1.7.8","permalink":"/changelog/v1-7-8"}},"content":"\x3c!--truncate--\x3e\\n\\n17/02/2025\\n\\n## New Features\\n\\n- **Cronjob Enhancements:** Configure cronjob policies and easily filter between active and inactive cronjobs.\\n- **Support Emails on Notifications:** When SleakOps generates a notification, users now receive it via email.\\n- **EKS Insights:** During cluster upgrades, SleakOps checks EKS Insights to ensure everything is running smoothly.\\n\\n## Bug Fixes\\n\\n- **Project Flow Improvements:** Enhanced various settings, forms, and other elements for smoother project management.\\n- **AWS Account Creation Flow:** Now supports inactive AWS accounts, providing clear guidance on how to manually activate them before resuming the process in SleakOps."},{"id":"v1-7-8","metadata":{"permalink":"/changelog/v1-7-8","source":"@site/changelog/2025-02-10-V1.7.8.md","title":"Version 1.7.8","description":"10/02/2025","date":"2025-02-10T00:00:00.000Z","tags":[{"inline":true,"label":"release","permalink":"/changelog/tags/release"}],"hasTruncateMarker":true,"authors":[],"frontMatter":{"title":"Version 1.7.8","slug":"v1-7-8","date":"2025-02-10T00:00:00.000Z","tags":["release"]},"unlisted":false,"prevItem":{"title":"Version 1.7.9","permalink":"/changelog/v1-7-9"},"nextItem":{"title":"Version 1.7.7","permalink":"/changelog/v1-7-7"}},"content":"\x3c!--truncate--\x3e\\n\\n10/02/2025\\n\\n## New Features\\n\\n- **Kubernetes 1.30:** Updated EKS support to version 1.30.\\n\\n## Bug Fixes\\n\\n- **Minor UI Enhancements:** Improved the visual design for project and workload screens."},{"id":"v1-7-7","metadata":{"permalink":"/changelog/v1-7-7","source":"@site/changelog/2025-02-05-V1.7.7.md","title":"Version 1.7.7","description":"05/02/2025","date":"2025-02-05T00:00:00.000Z","tags":[{"inline":true,"label":"release","permalink":"/changelog/tags/release"}],"hasTruncateMarker":true,"authors":[],"frontMatter":{"title":"Version 1.7.7","slug":"v1-7-7","date":"2025-02-05T00:00:00.000Z","tags":["release"]},"unlisted":false,"prevItem":{"title":"Version 1.7.8","permalink":"/changelog/v1-7-8"},"nextItem":{"title":"Version 1.7.6","permalink":"/changelog/v1-7-6"}},"content":"\x3c!--truncate--\x3e\\n\\n05/02/2025\\n\\n## New Features\\n\\n- **Import from External Buckets:** Quickly copy files from an external S3 Bucket into SleakOps via the new Import Bucket feature.\\n- **Project View Overhaul:** See logs and key info in a single screen for better visibility.\\n- **Executions Renamed to Workloads:** Updated terminology to align with internal cluster notation.\\n- **Cluster Deletion Optimization:** Added extra validation for a more secure and stable deletion process.\\n\\n## Bug Fixes\\n\\n- **Project Permissions for Jobs:** Fixed an issue where Jobs used cluster node permissions instead of Project permissions.\\n- **Docker Args Modification:** Builds now correctly apply any Docker Args changed just before they run.\\n- **VPN Profile Generation:** Resolved an issue preventing third-party user profiles from being generated successfully."},{"id":"v1-7-6","metadata":{"permalink":"/changelog/v1-7-6","source":"@site/changelog/2025-01-06-V1.7.6.md","title":"Version 1.7.6","description":"06/01/2025","date":"2025-01-06T00:00:00.000Z","tags":[{"inline":true,"label":"release","permalink":"/changelog/tags/release"}],"hasTruncateMarker":true,"authors":[],"frontMatter":{"title":"Version 1.7.6","slug":"v1-7-6","date":"2025-01-06T00:00:00.000Z","tags":["release"]},"unlisted":false,"prevItem":{"title":"Version 1.7.7","permalink":"/changelog/v1-7-7"},"nextItem":{"title":"Version 1.7.5","permalink":"/changelog/v1-7-5"}},"content":"\x3c!--truncate--\x3e\\n\\n06/01/2025\\n\\n## New Features\\n\\n- **New Nodepool Configurations**: You can now set additional parameters, such as minimum instance sizes and more.\\n- **Job with Specific Images**: When creating a job, you can specify the exact image and tag you want to run (e.g., `postgres:16.4`).\\n- **(BETA) Chart Extension by Project**: SleakOps can now extend the charts used to deploy project workloads, allowing you to add dependencies. For more information, see the [Helm documentation](https://helm.sh/docs/helm/helm_dependency/).\\n- **CI/CD Improvements**: The file for configuring CI/CD has been simplified and optimized.\\n\\n## Bug Fixes\\n\\n- **Internal Web Service URL**: Fixed an issue that caused incorrect URLs for \u201cinternal\u201d type web services.\\n- **Volume Deletion**: Resolved problems related to volume deletion under various retention policies.\\n- **UX/UI Enhancements**: Improvements in the interface for Projects, Volumes, and Variable Groups."},{"id":"v1-7-5","metadata":{"permalink":"/changelog/v1-7-5","source":"@site/changelog/2024-12-09-V1.7.5.md","title":"Version 1.7.5","description":"09/12/2024","date":"2024-12-09T00:00:00.000Z","tags":[{"inline":true,"label":"release","permalink":"/changelog/tags/release"}],"hasTruncateMarker":true,"authors":[],"frontMatter":{"title":"Version 1.7.5","slug":"v1-7-5","date":"2024-12-09T00:00:00.000Z","tags":["release"]},"unlisted":false,"prevItem":{"title":"Version 1.7.6","permalink":"/changelog/v1-7-6"},"nextItem":{"title":"Version 1.7.4","permalink":"/changelog/v1-7-4"}},"content":"\x3c!--truncate--\x3e\\n\\n09/12/2024\\n\\n## New Features\\n\\n- **AWS Integration Error Handling:**: Implemented a mechanism to handle delays in AWS account activations created by SleakOps.\\n- **Add-on Links in Builds:** Added links for easily viewing logs and metrics during the build process."},{"id":"v1-7-4","metadata":{"permalink":"/changelog/v1-7-4","source":"@site/changelog/2024-12-05-V1.7.4.md","title":"Version 1.7.4","description":"05/12/2024","date":"2024-12-05T00:00:00.000Z","tags":[{"inline":true,"label":"release","permalink":"/changelog/tags/release"}],"hasTruncateMarker":true,"authors":[],"frontMatter":{"title":"Version 1.7.4","slug":"v1-7-4","date":"2024-12-05T00:00:00.000Z","tags":["release"]},"unlisted":false,"prevItem":{"title":"Version 1.7.5","permalink":"/changelog/v1-7-5"},"nextItem":{"title":"Version 1.2.1","permalink":"/changelog/v1-2-1"}},"content":"\x3c!--truncate--\x3e\\n\\n05/12/2024\\n\\n## New Features\\n\\n- **Add-on Accessibility:** Added links in SleakOps for easy access to view logs, APM, or metrics for specific resources.\\n- **OpenTelemetry (Beta):** Introduced an add-on to enhance observability in applications deployed with SleakOps. With OpenTelemetry, you can have your own APM to monitor metrics like request rate, latency, and error rate of your application.\\n- **Add-on Availability Configurations:** Added various availability settings for each add-on.\\n- **Documentation:** Updated the add-on documentation and made it available in Spanish.\\n\\n## Bug Fixes\\n\\n- **Kubecost Integration Review:** Reviewed the Prometheus-Kubecost integration. Kubecost now correctly maps the names of deployed resources to their costs, greatly improving the accuracy of its estimates. It\'s now possible to enable approximate network traffic cost analysis within the cluster in Kubecost (Beta)."},{"id":"v1-2-1","metadata":{"permalink":"/changelog/v1-2-1","source":"@site/changelog/2024-01-12-V1.2.1.md","title":"Version 1.2.1","description":"12/01/2024","date":"2024-12-01T00:00:00.000Z","tags":[{"inline":true,"label":"release","permalink":"/changelog/tags/release"}],"hasTruncateMarker":true,"authors":[],"frontMatter":{"title":"Version 1.2.1","slug":"v1-2-1","date":"2024-12-01T00:00:00.000Z","tags":["release"]},"unlisted":false,"prevItem":{"title":"Version 1.7.4","permalink":"/changelog/v1-7-4"},"nextItem":{"title":"Version 1.7.3","permalink":"/changelog/v1-7-3"}},"content":"\x3c!--truncate--\x3e\\n\\n12/01/2024\\n\\n## New Features\\n\\n- **Vargroup Form Optimization:** Usability improvements have been made to the Vargroup forms.\\n- **Provider and User Account Deletion:** Deleting a provider now also deletes associated user accounts.\\n\\n## Bug Fixes\\n\\n- A bug in ACM certificate regeneration has been fixed.\\n- A provider deletion issue has been corrected."},{"id":"v1-7-3","metadata":{"permalink":"/changelog/v1-7-3","source":"@site/changelog/2024-11-14-V1.7.3.md","title":"Version 1.7.3","description":"14/11/2024","date":"2024-11-14T00:00:00.000Z","tags":[{"inline":true,"label":"release","permalink":"/changelog/tags/release"}],"hasTruncateMarker":true,"authors":[],"frontMatter":{"title":"Version 1.7.3","slug":"v1-7-3","date":"2024-11-14T00:00:00.000Z","tags":["release"]},"unlisted":false,"prevItem":{"title":"Version 1.2.1","permalink":"/changelog/v1-2-1"},"nextItem":{"title":"Version 1.7.2","permalink":"/changelog/v1-7-2"}},"content":"\x3c!--truncate--\x3e\\n\\n14/11/2024\\n\\n## New Features\\n\\n- **Oracle RDS Support (Beta):** You can now manage Oracle RDS instances as dependencies within SleakOps.\\n- **Aurora PostgreSQL Serverless Support (Beta):** Added the ability to create and manage Aurora PostgreSQL Serverless databases.\\n\\n## Bug Fixes\\n\\n- Various minor bug fixes."},{"id":"v1-7-2","metadata":{"permalink":"/changelog/v1-7-2","source":"@site/changelog/2024-11-05-V1.7.2.md","title":"Version 1.7.2","description":"05/11/2024","date":"2024-11-05T00:00:00.000Z","tags":[{"inline":true,"label":"release","permalink":"/changelog/tags/release"}],"hasTruncateMarker":true,"authors":[],"frontMatter":{"title":"Version 1.7.2","slug":"v1-7-2","date":"2024-11-05T00:00:00.000Z","tags":["release"]},"unlisted":false,"prevItem":{"title":"Version 1.7.3","permalink":"/changelog/v1-7-3"},"nextItem":{"title":"Version 1.7.1","permalink":"/changelog/v1-7-1"}},"content":"\x3c!--truncate--\x3e\\n\\n05/11/2024\\n\\n## New Features\\n\\n- **S3 Bucket Deletion:** Introduced the ability to delete S3 buckets containing a large number of files.\\n- **VPN:** Updated the Pritunl module to the latest version for enhanced security and performance.\\n- **Subscription Management Improvements:** Enhanced the management of subscriptions for a better user experience.\\n- **User Registration:** Enabled the registration of new users to the platform.\\n\\n## Bug Fixes\\n\\n- Various minor bug fixes."},{"id":"v1-7-1","metadata":{"permalink":"/changelog/v1-7-1","source":"@site/changelog/2024-10-30-V1.7.1.md","title":"Version 1.7.1","description":"30/10/2024","date":"2024-10-30T00:00:00.000Z","tags":[{"inline":true,"label":"release","permalink":"/changelog/tags/release"}],"hasTruncateMarker":true,"authors":[],"frontMatter":{"title":"Version 1.7.1","slug":"v1-7-1","date":"2024-10-30T00:00:00.000Z","tags":["release"]},"unlisted":false,"prevItem":{"title":"Version 1.7.2","permalink":"/changelog/v1-7-2"},"nextItem":{"title":"Version 1.7.0","permalink":"/changelog/v1-7-0"}},"content":"\x3c!--truncate--\x3e\\n\\n30/10/2024\\n\\n## New Features\\n\\n- **Environment and Domain Creation:** Improved the process for creating environments and domains. You can now use a different domain than the one configured globally without any limitations.\\n- **Notifications:** Added a notification system to inform users about pending manual actions and scheduled infrastructure updates.\\n- **Documentation:** Updated documentation on managing domains, projects, dependencies, and environment variables.\\n\\n## Bug Fixes\\n\\n- Various minor bug fixes."},{"id":"v1-7-0","metadata":{"permalink":"/changelog/v1-7-0","source":"@site/changelog/2024-10-14-V1.7.0.md","title":"Version 1.7.0","description":"14/10/2024","date":"2024-10-14T00:00:00.000Z","tags":[{"inline":true,"label":"release","permalink":"/changelog/tags/release"}],"hasTruncateMarker":true,"authors":[],"frontMatter":{"title":"Version 1.7.0","slug":"v1-7-0","date":"2024-10-14T00:00:00.000Z","tags":["release"]},"unlisted":false,"prevItem":{"title":"Version 1.7.1","permalink":"/changelog/v1-7-1"},"nextItem":{"title":"Version 1.6.3","permalink":"/changelog/v1-6-3"}},"content":"\x3c!--truncate--\x3e\\n\\n14/10/2024\\n\\n## New Features\\n\\n- **Advanced Node Management:** Introduced node pool management to provide greater control over the types of nodes where workloads are executed.\\n- **Cluster Module Migration:** All modules created with the cluster now run on Graviton instances, enhancing performance and reducing costs.\\n- **Cluster Add-ons:** All add-ons now run on Graviton instances, further improving performance and lowering costs.\\n- **Isolated Build Nodes:** Builds are now executed on dedicated nodes separate from the application nodes, improving the stability of the nodes running applications.\\n\\n## Bug Fixes\\n\\n- Various minor bug fixes."},{"id":"v1-6-3","metadata":{"permalink":"/changelog/v1-6-3","source":"@site/changelog/2024-09-27-V1.6.3.md","title":"Version 1.6.3","description":"27/09/2024","date":"2024-09-27T00:00:00.000Z","tags":[{"inline":true,"label":"release","permalink":"/changelog/tags/release"}],"hasTruncateMarker":true,"authors":[],"frontMatter":{"title":"Version 1.6.3","slug":"v1-6-3","date":"2024-09-27T00:00:00.000Z","tags":["release"]},"unlisted":false,"prevItem":{"title":"Version 1.7.0","permalink":"/changelog/v1-7-0"},"nextItem":{"title":"Version 1.6.2","permalink":"/changelog/v1-6-2"}},"content":"\x3c!--truncate--\x3e\\n\\n27/09/2024\\n\\n## New Features\\n\\n- **Registration:** Implemented a new registration flow.\\n\\n## Bug Fixes\\n\\n- Various minor bug fixes and improvements."},{"id":"v1-6-2","metadata":{"permalink":"/changelog/v1-6-2","source":"@site/changelog/2024-09-19-V1.6.2.md","title":"Version 1.6.2","description":"09/19/2024","date":"2024-09-19T00:00:00.000Z","tags":[{"inline":true,"label":"release","permalink":"/changelog/tags/release"}],"hasTruncateMarker":true,"authors":[],"frontMatter":{"title":"Version 1.6.2","slug":"v1-6-2","date":"2024-09-19T00:00:00.000Z","tags":["release"]},"unlisted":false,"prevItem":{"title":"Version 1.6.3","permalink":"/changelog/v1-6-3"},"nextItem":{"title":"Version 1.6.1","permalink":"/changelog/v1-6-1"}},"content":"\x3c!--truncate--\x3e\\n\\n09/19/2024\\n\\n## New Features\\n\\n- **Upgrades:** Updated **Prometheus**, **Loki**, and **EBS CSI Driver** to the latest versions as of August 2024.\\n- **EBS CSI Driver Migration:** SleakOps now uses the AWS-managed EKS Addon for the EBS CSI Driver, replacing the self-managed version.\\n- **Prometheus and Loki with EBS:** Prometheus now utilizes EBS volumes for data persistence, preventing data loss even if the pods crash.\\n- **Loki with SimpleScalable: I**t adopts a **SimpleScalable** structure with **TSDB** storage for logs, enhancing performance.\\n- **SQS Dead-letter Queues:** Now supports the creation of **SQS queues** with associated dead-letter queues for improved error handling.\\n\\n## Bug Fixes\\n\\n- Various minor bug fixes and improvements to the platform\'s workload flows."},{"id":"v1-6-1","metadata":{"permalink":"/changelog/v1-6-1","source":"@site/changelog/2024-08-22-V1.6.1.md","title":"Version 1.6.1","description":"08/22/2024","date":"2024-08-22T00:00:00.000Z","tags":[{"inline":true,"label":"release","permalink":"/changelog/tags/release"}],"hasTruncateMarker":true,"authors":[],"frontMatter":{"title":"Version 1.6.1","slug":"v1-6-1","date":"2024-08-22T00:00:00.000Z","tags":["release"]},"unlisted":false,"prevItem":{"title":"Version 1.6.2","permalink":"/changelog/v1-6-2"},"nextItem":{"title":"Version 1.6.0","permalink":"/changelog/v1-6-0"}},"content":"\x3c!--truncate--\x3e\\n\\n08/22/2024\\n\\n## New Features\\n\\n- **Dependency Version Updates:** Updated versions of MQ, Elasticsearch, Memcache, and Redis dependencies.\\n- **Authentication Improvements:** Added support for storing authentication tokens via cookies instead of local storage.\\n- Added ACM validation record printing on the ACM detail screen, and ACM status is now included in the system.\\n\\n## Bug Fixes\\n\\n- Issues with the provider flow have been resolved."},{"id":"v1-6-0","metadata":{"permalink":"/changelog/v1-6-0","source":"@site/changelog/2024-08-12-V1.6.0.md","title":"Version 1.6.0","description":"08/12/2024","date":"2024-08-12T00:00:00.000Z","tags":[{"inline":true,"label":"release","permalink":"/changelog/tags/release"}],"hasTruncateMarker":true,"authors":[],"frontMatter":{"title":"Version 1.6.0","slug":"v1-6-0","date":"2024-08-12T00:00:00.000Z","tags":["release"]},"unlisted":false,"prevItem":{"title":"Version 1.6.1","permalink":"/changelog/v1-6-1"},"nextItem":{"title":"Version 1.5.1","permalink":"/changelog/v1-5-1"}},"content":"\x3c!--truncate--\x3e\\n\\n08/12/2024\\n\\n## New Features\\n\\n- **Support for ARM Instances and Additional RDS Versions:** Added ARM instances and extra versions in RDS.\\n- **EKS Updated to Version 1.29:** EKS has been updated to version 1.29. Changelogs for EKS updates are now displayed.\\n- **Improvements in Provider Creation and Editing:** Screens and fields for provider forms were updated, including changes in states and visual display.\\n- **Improved Repository Search:** Added support for asynchronous search in the repository selector and enhanced the search function for GitHub, GitLab, and Bitbucket.\\n- **Healthcheck Parameterization:** Healthcheck properties can now be parameterized with JSONSchema.\\n- **New Dashboard:** A new dashboard has been added to view consumption by namespace.\\n- Fixed an error when regenerating certificates, as well as issues with builds not running properly.\\n- Frontend errors related to listing and API problems that caused filtering errors have been corrected.\\n\\n## Bug Fixes\\n\\n- Fixed an error when regenerating certificates, as well as issues with builds not running properly.\\n- Frontend errors related to listing and API problems that caused filtering errors have been corrected."},{"id":"v1-5-1","metadata":{"permalink":"/changelog/v1-5-1","source":"@site/changelog/2024-06-24-V1.5.1.md","title":"Version 1.5.1","description":"06/24/2024","date":"2024-06-24T00:00:00.000Z","tags":[{"inline":true,"label":"release","permalink":"/changelog/tags/release"}],"hasTruncateMarker":true,"authors":[],"frontMatter":{"title":"Version 1.5.1","slug":"v1-5-1","date":"2024-06-24T00:00:00.000Z","tags":["release"]},"unlisted":false,"prevItem":{"title":"Version 1.6.0","permalink":"/changelog/v1-6-0"},"nextItem":{"title":"Version 1.5.0","permalink":"/changelog/v1-5-0"}},"content":"\x3c!--truncate--\x3e\\n\\n06/24/2024\\n\\n## New Features\\n\\n- **Advanced Resource Configuration:** Advanced options for resource configuration in project environments have been implemented.\\n- **Optimization of Data Collection Scripts:** Improved the efficiency of data collection scripts for faster workload.\\n\\n## Bug Fixes\\n\\n- Several interface errors affecting system usability have been resolved."},{"id":"v1-5-0","metadata":{"permalink":"/changelog/v1-5-0","source":"@site/changelog/2024-05-23-V1.5.0.md","title":"Version 1.5.0","description":"05/23/2024","date":"2024-05-23T00:00:00.000Z","tags":[{"inline":true,"label":"release","permalink":"/changelog/tags/release"}],"hasTruncateMarker":true,"authors":[],"frontMatter":{"title":"Version 1.5.0","slug":"v1-5-0","date":"2024-05-23T00:00:00.000Z","tags":["release"]},"unlisted":false,"prevItem":{"title":"Version 1.5.1","permalink":"/changelog/v1-5-1"},"nextItem":{"title":"Version 1.4.3","permalink":"/changelog/v1-4-3"}},"content":"\x3c!--truncate--\x3e\\n\\n05/23/2024\\n\\n## New Features\\n\\n- **Multiple Project Environments Creation:** You can now create multiple project environments using the same repository and branch.\\n- **Domain Validation for Aliases:** Improved domain creation validation for aliases by using an existing usable ACM for ingress.\\n- **Resource Configuration in Project Env:** Added the ability to configure build and deploy resources per project environment.\\n- **Deploy and Build Request Configuration:** Added the option to configure deploy and build requests in a ProjectEnv.\\n- **Grafana Dashboard:** A Grafana dashboard was incorporated to visualize consumption by namespace.\\n- **Loki Configuration:** Logs can now be searched by namespace with the new Loki configuration.\\n- **Data Collection:** Improved the billing collection script to be idempotent and executable for specific dates.\\n\\n## Bug Fixes\\n\\n- Fixed an error when creating S3 dependencies and solved a critical problem with vargroups during cluster shutdown updates.\\n- Fixed a critical error when inviting collaborators."},{"id":"v1-4-3","metadata":{"permalink":"/changelog/v1-4-3","source":"@site/changelog/2024-05-13-V1.4.3.md","title":"Version 1.4.3","description":"05/13/2024","date":"2024-05-13T00:00:00.000Z","tags":[{"inline":true,"label":"release","permalink":"/changelog/tags/release"}],"hasTruncateMarker":true,"authors":[],"frontMatter":{"title":"Version 1.4.3","slug":"v1-4-3","date":"2024-05-13T00:00:00.000Z","tags":["release"]},"unlisted":false,"prevItem":{"title":"Version 1.5.0","permalink":"/changelog/v1-5-0"},"nextItem":{"title":"Version 1.4.2","permalink":"/changelog/v1-4-2"}},"content":"\x3c!--truncate--\x3e\\n\\n05/13/2024\\n\\n## New Features\\n\\n- **Dashboard Management Improvements:** Dashboard loading was improved, allowing it to be viewed even if no account is selected.\\n- **Billing and Project Screen Improvements:** Improvements to the billing screen were made, including a new \\"others\\" section to account for previously unconsidered costs. The project environment screen was also improved.\\n- **Policy Updates:** CloudFormation policy has been updated to enhance management and security.\\n\\n## Bug Fixes\\n\\n- Fixed a critical error that prevented the creation of providers.\\n- Reviewed and resolved an issue related to NewRelic integration.\\n- Fixed a problem with the refresh token when requesting the VPN URI.\\n- **ACM Validation Screen and Build Logs Errors:** Corrections made to the ACM validation table and logs display for builds in creation state."},{"id":"v1-4-2","metadata":{"permalink":"/changelog/v1-4-2","source":"@site/changelog/2024-04-25-V1.4.2.md","title":"Version 1.4.2","description":"04/25/2024","date":"2024-04-25T00:00:00.000Z","tags":[{"inline":true,"label":"release","permalink":"/changelog/tags/release"}],"hasTruncateMarker":true,"authors":[],"frontMatter":{"title":"Version 1.4.2","slug":"v1-4-2","date":"2024-04-25T00:00:00.000Z","tags":["release"]},"unlisted":false,"prevItem":{"title":"Version 1.4.3","permalink":"/changelog/v1-4-3"},"nextItem":{"title":"Version 1.4.1","permalink":"/changelog/v1-4-1"}},"content":"\x3c!--truncate--\x3e\\n\\n04/25/2024\\n\\n## New Features\\n\\n- **New Metrics:** Added new metrics for S3 buckets and RabbitMQ, improving service monitoring. An OpenSearch metrics monitoring system was also implemented.\\n- **Monitoring Schema Reorganization:** Monitoring schema structures were reorganized for better management and visualization. The Dependencies monitoring screen now supports different resource types, providing a more detailed view.\\n\\n## Bug Fixes\\n\\n- A critical issue with vargroups was resolved, ensuring their proper functioning."},{"id":"v1-4-1","metadata":{"permalink":"/changelog/v1-4-1","source":"@site/changelog/2024-04-11-V1.4.1.md","title":"Version 1.4.1","description":"04/11/2024","date":"2024-04-11T00:00:00.000Z","tags":[{"inline":true,"label":"release","permalink":"/changelog/tags/release"}],"hasTruncateMarker":true,"authors":[],"frontMatter":{"title":"Version 1.4.1","slug":"v1-4-1","date":"2024-04-11T00:00:00.000Z","tags":["release"]},"unlisted":false,"prevItem":{"title":"Version 1.4.2","permalink":"/changelog/v1-4-2"},"nextItem":{"title":"Version 1.4.0","permalink":"/changelog/v1-4-0"}},"content":"\x3c!--truncate--\x3e\\n\\n04/11/2024\\n\\n## New Features\\n\\n- **Dependency and OpenSearch Monitoring:** A new monitoring page was created for dependencies, facilitating the tracking of their status. OpenSearch was included.\\n- **ECR Lifecycle Policy:** A lifecycle policy was configured for ECR, improving image management.\\n\\n## Bug Fixes\\n\\n- Fixed the issue of duplicate names between cluster and node in Redis.\\n- Resolved various frontend errors that affected the user experience.\\n- Fixed the problem where an error was displayed when attempting to publish a vargroup without an associated service.\\n- Issues with performing multiple deployments and releases in a row were fixed."},{"id":"v1-4-0","metadata":{"permalink":"/changelog/v1-4-0","source":"@site/changelog/2024-03-06-V1.4.0.md","title":"Version 1.4.0","description":"03/06/2024","date":"2024-03-06T00:00:00.000Z","tags":[{"inline":true,"label":"release","permalink":"/changelog/tags/release"}],"hasTruncateMarker":true,"authors":[],"frontMatter":{"title":"Version 1.4.0","slug":"v1-4-0","date":"2024-03-06T00:00:00.000Z","tags":["release"]},"unlisted":false,"prevItem":{"title":"Version 1.4.1","permalink":"/changelog/v1-4-1"},"nextItem":{"title":"Version 1.3.0","permalink":"/changelog/v1-3-0"}},"content":"\x3c!--truncate--\x3e\\n\\n03/06/2024\\n\\n## New Features\\n\\n- **Grafana Configuration:** The database for the Grafana addon was configured, along with DataSources and Dashboards.\\n- **Prometheus Metrics Persistence with Thanos:** Added support for persisting Prometheus metrics using Thanos.\\n- **New Volume API:** Implemented support for the new volume API, displaying statuses and applying configuration for deployments.\\n- The update option in addons has been disabled.\\n- Now, when a dependency is deleted, a deploy with \\"pending-approval\\" will be created instead of an automatic one.\\n\\n## Bug Fixes\\n\\n- Fixed an issue where pre-hooks and new volumes were added during deploys, preventing them from being generated.\\n- Subdomains are now correctly marked as delegated if the parent domains are already delegated."},{"id":"v1-3-0","metadata":{"permalink":"/changelog/v1-3-0","source":"@site/changelog/2024-03-01-V1.3.0.md","title":"Version 1.3.0","description":"01/03/2024","date":"2024-03-01T00:00:00.000Z","tags":[{"inline":true,"label":"release","permalink":"/changelog/tags/release"}],"hasTruncateMarker":true,"authors":[],"frontMatter":{"title":"Version 1.3.0","slug":"v1-3-0","date":"2024-03-01T00:00:00.000Z","tags":["release"]},"unlisted":false,"prevItem":{"title":"Version 1.4.0","permalink":"/changelog/v1-4-0"},"nextItem":{"title":"Version 1.2.4","permalink":"/changelog/v1-2-4"}},"content":"\x3c!--truncate--\x3e\\n\\n01/03/2024\\n\\n## New Features\\n\\n- **Project Details View:** A detailed project view is now available in the new interface.\\n- **RDS Metrics API:** A new API for displaying RDS metrics has been added, improving resource visibility.\\n- **Improved LogViewer:** LogViewer loading is now faster and more efficient.\\n- **Enhanced Onboarding:** A new onboarding process has been implemented for easier setup.\\n- **Redis Monitoring:** Redis monitoring has been added, improving infrastructure supervision.\\n- **RDS Replica Configuration:** The option to configure replicas in the RDS Dependency has been added for more flexibility.\\n- **Domain Deletion Status:** Domain deletion now creates a deploy with `pending-approval` status, rather than an automatic deploy.\\n- **Job Workload Improvements:** Job workload has been improved, allowing automatic retries in case of an initial failure.\\n\\n## Bug Fixes\\n\\n- Bitbucket integration issues have been resolved.\\n- Undefined value issues in Vargroups have been fixed."},{"id":"v1-2-4","metadata":{"permalink":"/changelog/v1-2-4","source":"@site/changelog/2024-02-15-V1.2.4.md","title":"Version 1.2.4","description":"15/02/2024","date":"2024-02-15T00:00:00.000Z","tags":[{"inline":true,"label":"release","permalink":"/changelog/tags/release"}],"hasTruncateMarker":true,"authors":[],"frontMatter":{"title":"Version 1.2.4","slug":"v1-2-4","date":"2024-02-15T00:00:00.000Z","tags":["release"]},"unlisted":false,"prevItem":{"title":"Version 1.3.0","permalink":"/changelog/v1-3-0"},"nextItem":{"title":"Version 1.2.3","permalink":"/changelog/v1-2-3"}},"content":"\x3c!--truncate--\x3e\\n\\n15/02/2024\\n\\n## New Features\\n\\n- **Cluster Switcher Optimization:** Cluster selector behavior has been optimized.\\n- **Login in AWS Subscription Flow:** The AWS subscription flow now includes the ability to log in directly.\\n\\n## Bug Fixes\\n\\n- Callback issues for Git integrations and Docker file path for GitLab have been resolved.\\n- Minor billing screen-related bugs have been fixed."},{"id":"v1-2-3","metadata":{"permalink":"/changelog/v1-2-3","source":"@site/changelog/2024-02-05-V1.2.3.md","title":"Version 1.2.3","description":"05/02/2024","date":"2024-02-05T00:00:00.000Z","tags":[{"inline":true,"label":"release","permalink":"/changelog/tags/release"}],"hasTruncateMarker":true,"authors":[],"frontMatter":{"title":"Version 1.2.3","slug":"v1-2-3","date":"2024-02-05T00:00:00.000Z","tags":["release"]},"unlisted":false,"prevItem":{"title":"Version 1.2.4","permalink":"/changelog/v1-2-4"},"nextItem":{"title":"Version 1.2.2","permalink":"/changelog/v1-2-2"}},"content":"\x3c!--truncate--\x3e\\n\\n05/02/2024\\n\\n## New Features\\n\\n- **Alias Decoupling in Web Services:** The creation of aliases is now separated from the web services form.\\n- **IAM Password Reset:** It is now possible to reset the IAM password for a user.\\n\\n## Bug Fixes\\n\\n- A minor issue with release tasks has been corrected."},{"id":"v1-2-2","metadata":{"permalink":"/changelog/v1-2-2","source":"@site/changelog/2024-01-25-V1.2.2.md","title":"Version 1.2.2","description":"25/01/2024","date":"2024-01-25T00:00:00.000Z","tags":[{"inline":true,"label":"release","permalink":"/changelog/tags/release"}],"hasTruncateMarker":true,"authors":[],"frontMatter":{"title":"Version 1.2.2","slug":"v1-2-2","date":"2024-01-25T00:00:00.000Z","tags":["release"]},"unlisted":false,"prevItem":{"title":"Version 1.2.3","permalink":"/changelog/v1-2-3"},"nextItem":{"title":"Version 1.2.0","permalink":"/changelog/v1-2-0"}},"content":"\x3c!--truncate--\x3e\\n\\n25/01/2024\\n\\n## New Features\\n\\n- **Domain Validation Button:** A \\"check validation\\" button has been added to the domain drawer for easier domain management.\\n- **Activity Log Table:** An activity log table has been created.\\n- **Access Key Encryption:** Access keys for code version providers (GIT) are now encrypted.\\n\\n## Bug Fixes\\n\\n- An issue where the API didn\'t correctly recreate the ACM module during regeneration has been fixed."},{"id":"v1-2-0","metadata":{"permalink":"/changelog/v1-2-0","source":"@site/changelog/2024-01-05-V1.2.0.md","title":"Version 1.2.0","description":"05/01/2024","date":"2024-01-05T00:00:00.000Z","tags":[{"inline":true,"label":"release","permalink":"/changelog/tags/release"}],"hasTruncateMarker":true,"authors":[],"frontMatter":{"title":"Version 1.2.0","slug":"v1-2-0","date":"2024-01-05T00:00:00.000Z","tags":["release"]},"unlisted":false,"prevItem":{"title":"Version 1.2.2","permalink":"/changelog/v1-2-2"},"nextItem":{"title":"Version 1.1.1","permalink":"/changelog/v1-1-1"}},"content":"\x3c!--truncate--\x3e\\n\\n05/01/2024\\n\\n## New Features\\n\\n- **Logs in Grafana:** A data source has been configured in Grafana to display logs from S3.\\n- **Cluster Update Button:** A button has been added to allow cluster updates from the interface.\\n- **User Activity Log:** An activity log for user actions has been created.\\n- **Domain Validation Deploy:** You can now create a deploy that runs once domains are validated.\\n- **Two-Factor Authentication:** Two-factor authentication (2FA) has been added to the login for enhanced security.\\n\\n## Bug Fixes\\n\\n- An issue with builds using the same branch as the default has been fixed.\\n- Log reading has been improved for faster processing.\\n- Various frontend optimizations, including styles, search, and pending resource visibility, have been made."},{"id":"v1-1-1","metadata":{"permalink":"/changelog/v1-1-1","source":"@site/changelog/2023-12-05-V1.1.1.md","title":"Version 1.1.1","description":"05/12/2023","date":"2023-12-05T00:00:00.000Z","tags":[{"inline":true,"label":"release","permalink":"/changelog/tags/release"}],"hasTruncateMarker":true,"authors":[],"frontMatter":{"title":"Version 1.1.1","slug":"v1-1-1","date":"2023-12-05T00:00:00.000Z","tags":["release"]},"unlisted":false,"prevItem":{"title":"Version 1.2.0","permalink":"/changelog/v1-2-0"},"nextItem":{"title":"Version 1.1.0","permalink":"/changelog/v1-1-0"}},"content":"\x3c!--truncate--\x3e\\n\\n05/12/2023\\n\\n## New Features\\n\\n- **Log Viewer in Jobs:** Added a log viewer in the job list, similar to what already exists for deployments.\\n- **Dashboard v2:** Improvements in the second version of the Dashboard, with more options and better organization of information.\\n- **Cluster Certificates:** Cluster certificates are now automatically deleted and updated to prevent expiration issues."},{"id":"v1-1-0","metadata":{"permalink":"/changelog/v1-1-0","source":"@site/changelog/2023-11-06-V1.1.0.md","title":"Version 1.1.0","description":"06/11/2023","date":"2023-11-06T00:00:00.000Z","tags":[{"inline":true,"label":"release","permalink":"/changelog/tags/release"}],"hasTruncateMarker":true,"authors":[],"frontMatter":{"title":"Version 1.1.0","slug":"v1-1-0","date":"2023-11-06T00:00:00.000Z","tags":["release"]},"unlisted":false,"prevItem":{"title":"Version 1.1.1","permalink":"/changelog/v1-1-1"},"nextItem":{"title":"Version 1.0.5","permalink":"/changelog/v1-0-5"}},"content":"\x3c!--truncate--\x3e\\n\\n06/11/2023\\n\\n## New Features\\n\\n- **Vargroups Management:** Added the option to show vargroups in the forms for services, workers, hooks, and cronjobs.\\n- **Kubecost:** Integrated Kubecost with Prometheus-stack.\\n\\n## Bug Fixes\\n\\n- Solved the issue with Karpenter on spot instances.\\n- Fixed user roles and user editing.\\n- Corrected problems when deleting an environment and the incorrect deletion of domains.\\n- Fixed the error when trying to manually start the cluster.\\n- Resolved an error in generating hooks."},{"id":"v1-0-5","metadata":{"permalink":"/changelog/v1-0-5","source":"@site/changelog/2023-10-27-V1.0.5.md","title":"Version 1.0.5","description":"27/10/2023","date":"2023-10-27T00:00:00.000Z","tags":[{"inline":true,"label":"release","permalink":"/changelog/tags/release"}],"hasTruncateMarker":true,"authors":[],"frontMatter":{"title":"Version 1.0.5","slug":"v1-0-5","date":"2023-10-27T00:00:00.000Z","tags":["release"]},"unlisted":false,"prevItem":{"title":"Version 1.1.0","permalink":"/changelog/v1-1-0"},"nextItem":{"title":"Version 1.0.4","permalink":"/changelog/v1-0-4"}},"content":"\x3c!--truncate--\x3e\\n\\n27/10/2023\\n\\n## Bug Fixes\\n\\n- Solved deployment issues and fixed Karpenter with spot instances.\\n- Fixed issues in deleting entities and validating service URLs."},{"id":"v1-0-4","metadata":{"permalink":"/changelog/v1-0-4","source":"@site/changelog/2023-10-11-V1.0.4.md","title":"Version 1.0.4","description":"11/10/2023","date":"2023-10-11T00:00:00.000Z","tags":[{"inline":true,"label":"release","permalink":"/changelog/tags/release"}],"hasTruncateMarker":true,"authors":[],"frontMatter":{"title":"Version 1.0.4","slug":"v1-0-4","date":"2023-10-11T00:00:00.000Z","tags":["release"]},"unlisted":false,"prevItem":{"title":"Version 1.0.5","permalink":"/changelog/v1-0-5"},"nextItem":{"title":"Version 1.0.3","permalink":"/changelog/v1-0-3"}},"content":"\x3c!--truncate--\x3e\\n\\n11/10/2023\\n\\n## New Features\\n\\n- **Refactoring and Improvements:** Refactored the dashboard and improved log visualization and the management of entity deletion.\\n\\n## Bug Fixes\\n\\n- Fixed user editing issues.\\n- Corrected cluster state management.\\n- Solved problems with environment domains.\\n- Fixed error handling in S3 responses with CloudFront."},{"id":"v1-0-3","metadata":{"permalink":"/changelog/v1-0-3","source":"@site/changelog/2023-09-25-V1.0.3.md","title":"Version 1.0.3","description":"25/09/2023","date":"2023-09-25T00:00:00.000Z","tags":[{"inline":true,"label":"release","permalink":"/changelog/tags/release"}],"hasTruncateMarker":true,"authors":[],"frontMatter":{"title":"Version 1.0.3","slug":"v1-0-3","date":"2023-09-25T00:00:00.000Z","tags":["release"]},"unlisted":false,"prevItem":{"title":"Version 1.0.4","permalink":"/changelog/v1-0-4"},"nextItem":{"title":"Version 1.0.2","permalink":"/changelog/v1-0-2"}},"content":"\x3c!--truncate--\x3e\\n\\n25/09/2023\\n\\n## New Features\\n\\n- **Management Buttons and Form Improvements:** Added buttons for resource management and improved variable mapping forms.\\n- **Cronjobs and Domain Regeneration:** You can now stop or activate cronjobs and regenerate domains.\\n\\n## Bug Fixes\\n\\n- Solved the issue of obtaining the VPN URI in Pritunl.\\n- Fixed the account selection issue for viewer users.\\n- Improved the handling of health check information sent to the backend."},{"id":"v1-0-2","metadata":{"permalink":"/changelog/v1-0-2","source":"@site/changelog/2023-09-04-V1.0.2.md","title":"Version 1.0.2","description":"04/09/2023","date":"2023-09-04T00:00:00.000Z","tags":[{"inline":true,"label":"release","permalink":"/changelog/tags/release"}],"hasTruncateMarker":true,"authors":[],"frontMatter":{"title":"Version 1.0.2","slug":"v1-0-2","date":"2023-09-04T00:00:00.000Z","tags":["release"]},"unlisted":false,"prevItem":{"title":"Version 1.0.3","permalink":"/changelog/v1-0-3"},"nextItem":{"title":"Version 1.0.1","permalink":"/changelog/v1-0-1"}},"content":"\x3c!--truncate--\x3e\\n\\n04/09/2023\\n\\n## New Features\\n\\n- **Deployment Optimization:** Simplified the deployment process and project environment (ProjectEnv) editing, facilitating configuration and deployment.\\n- **Resource and Configuration Adjustments:** You can now create custom aliases for buckets.\\n- **Health Check Improvements:** The readiness probe for services in the development account is now optional.\\n\\n## Bug Fixes\\n\\n- Solved issues related to VPN and security parameter configuration."},{"id":"v1-0-1","metadata":{"permalink":"/changelog/v1-0-1","source":"@site/changelog/2023-08-29-V1.0.1.md","title":"Version 1.0.1","description":"29/08/2023","date":"2023-08-29T00:00:00.000Z","tags":[{"inline":true,"label":"release","permalink":"/changelog/tags/release"}],"hasTruncateMarker":true,"authors":[],"frontMatter":{"title":"Version 1.0.1","slug":"v1-0-1","date":"2023-08-29T00:00:00.000Z","tags":["release"]},"unlisted":false,"prevItem":{"title":"Version 1.0.2","permalink":"/changelog/v1-0-2"},"nextItem":{"title":"Version 1.0.0","permalink":"/changelog/v1-0-0"}},"content":"\x3c!--truncate--\x3e\\n\\n29/08/2023\\n\\n## New Features\\n\\n- **Subscription Management:** Login and token updates are controlled based on the subscription status. Additionally, a new API was implemented to register users and companies, validating pending subscriptions, with a new model to better manage subscriptions, integrating AwsClient.\\n- **Marketplace Onboarding:** Simplified process for creating users who come from a marketplace."},{"id":"v1-0-0","metadata":{"permalink":"/changelog/v1-0-0","source":"@site/changelog/2023-08-23-V1.0.0.md","title":"Version 1.0.0","description":"23/08/2023","date":"2023-08-23T00:00:00.000Z","tags":[{"inline":true,"label":"release","permalink":"/changelog/tags/release"}],"hasTruncateMarker":true,"authors":[],"frontMatter":{"title":"Version 1.0.0","slug":"v1-0-0","date":"2023-08-23T00:00:00.000Z","tags":["release"]},"unlisted":false,"prevItem":{"title":"Version 1.0.1","permalink":"/changelog/v1-0-1"}},"content":"\x3c!--truncate--\x3e\\n\\n23/08/2023\\n\\n## New Features\\n\\n- **Volume Configuration:** You can now configure volumes in project environments directly from the form.\\n- **Nightly Shutdown with Timezone:** Added support for selecting time zones in the nightly shutdown.\\n- **Manual Cluster Startup:** New button to manually start clusters.\\n- **CloudFront Integration:** Support for using CloudFront to improve content delivery.\\n- **Automatic Backups:** You can configure automatic backups for dependencies.\\n- **Graviton Instances:** Support for using Graviton instances on nodes.\\n- **Encryption:** Implemented encryption in StackSettings for added security.\\n\\n## Bug Fixes\\n\\n- Resolved an issue in the billing API and cost estimation.\\n- Fixed errors when deleting Providers and VPNs.\\n- You can now delete ACM certificates used by a Load Balancer without problems."}]}}')}}]);