"use strict";(self.webpackChunkdocs=self.webpackChunkdocs||[]).push([[5122],{29450:e=>{e.exports=JSON.parse('{"archive":{"blogPosts":[{"id":"/2026/01/20/version-2.4.0","metadata":{"permalink":"/preview-docs/es/changelog/2026/01/20/version-2.4.0","source":"@site/i18n/es/docusaurus-plugin-content-blog-changelog/2026-01-20-version-2.4.0.md","title":"Versi\xf3n 2.4.0","description":"Versi\xf3n 2.4.0","date":"2026-01-20T00:00:00.000Z","tags":[{"inline":true,"label":"release","permalink":"/preview-docs/es/changelog/tags/release"}],"hasTruncateMarker":false,"authors":[{"name":"Equipo Sleakops","socials":{},"key":null,"page":null}],"frontMatter":{"title":"Versi\xf3n 2.4.0","authors":[{"name":"Equipo Sleakops"}],"tags":["release"]},"unlisted":false,"nextItem":{"title":"Versi\xf3n 2.3.2","permalink":"/preview-docs/es/changelog/v2-3-2"}},"content":"## **Versi\xf3n 2.4.0**\\n\\n\ud83d\uddd3\ufe0f\xa0_01/08/2026_\\n\\n**\ud83d\ude80 Nuevas Funciones:**\\n\\n- **Autodiagn\xf3stico de Cargas de Trabajo:** Con la ayuda de la IA, ahora puedes descubrir de forma r\xe1pida y sencilla qu\xe9 est\xe1 sucediendo con tus Cargas de Trabajo. Con un solo clic desde la consola, obtendr\xe1s un diagn\xf3stico completo.\\n- **Per\xedodo de Gracia para Cargas de Trabajo:** Soporte para configurar el per\xedodo de gracia en las Cargas de Trabajo.\\n- **Notificaciones de Etiquetas de Costo:** Se agregaron notificaciones para la configuraci\xf3n de etiquetas de costo.\\n- **Eliminaci\xf3n en Cascada:** Mejoras en el flujo de eliminaci\xf3n en cascada con Dependencias activas.\\n- **Grupos de Variables Basados en Archivos:** Mejoras en el formulario de Grupos de Variables para tipos de archivo.\\n- **Selector de Proyectos:** Mejoras en los formularios con selector de Proyectos.\\n- **Navegaci\xf3n de Registros de Actividad:** Se agregaron enlaces para navegar entre Registros de Actividad y recursos.\\n- **Barra Lateral:** Mejoras visuales en la barra lateral.\\n- **Pantalla de Facturaci\xf3n:** Mejoras en la pantalla de facturaci\xf3n.\\n- **Edici\xf3n de Dominios:** Posibilidad de modificar dominios en Entornos existentes.\\n- **Nombres de Variables:** Manejo de la longitud del nombre de la variable en Grupos de Variables.\\n- **Nombres de Entornos:** Ajustes en los nombres predeterminados de los Entornos.\\n- **Monitoreo de Dependencias:** Mejoras en el monitoreo de Dependencias.\\n- **Resoluciones Peque\xf1as:** Mejoras en la interfaz de usuario para bajas resoluciones o pantallas peque\xf1as.\\n- **Variables Modificadas:** Mejoras en el formulario de Grupos de Variables para marcar qu\xe9 variables fueron modificadas.\\n- **Puerto de Destino en Servicios Web:** Soporte para configurar el puerto de destino para servicios en Servicios Web.\\n\\n**\ud83d\udc1e Correcciones de Errores:**\\n\\n- **Nombres de Entornos:** Manejo de la longitud del nombre del Entorno.\\n- **Filtros Persistentes:** Los filtros de Proyecto y Entorno ahora persisten entre pantallas.\\n- **Iconos de Proyectos:** Iconos mejorados para Proyectos.\\n- **Complementos con Atributos Personalizados:** Se corrigi\xf3 la edici\xf3n de complementos con atributos personalizados.\\n- **R\xe9plicas de RDS:** Validaci\xf3n de la longitud de las r\xe9plicas de RDS.\\n- **URL de Servicios Web:** Se corrigi\xf3 la autogeneraci\xf3n de URL al editar un Servicio Web.\\n- **Selector de Proyectos:** Se corrigi\xf3 la visibilidad del selector de Proyectos.\\n- **Formularios de Nodepool:** Se corrigieron errores en los formularios de edici\xf3n y creaci\xf3n de Nodepool.\\n- **Transici\xf3n de Estado:** Se corrigi\xf3 la transici\xf3n del estado pendiente a completado.\\n- **Certificado SSL:** Se corrigieron las alertas para la validaci\xf3n del certificado SSL.\\n- **Clonaci\xf3n con Versiones:** Se corrigi\xf3 la clonaci\xf3n con versiones de Dependencias.\\n- **Correos Electr\xf3nicos de Notificaci\xf3n:** Se corrigieron errores visuales en los correos electr\xf3nicos de notificaci\xf3n.\\n- **URL de Clonaci\xf3n:** Se corrigi\xf3 la URL de Servicios Web en el flujo de clonaci\xf3n.\\n- **Eliminar Proyecto con RDS:** Se corrigi\xf3 la eliminaci\xf3n de un Proyecto con un RDS que tiene protecci\xf3n de eliminaci\xf3n habilitada."},{"id":"v2-3-2","metadata":{"permalink":"/preview-docs/es/changelog/v2-3-2","source":"@site/i18n/es/docusaurus-plugin-content-blog-changelog/2025-12-19-V2.3.2.md","title":"Versi\xf3n 2.3.2","description":"Nuevas Funcionalidades","date":"2025-12-19T00:00:00.000Z","tags":[{"inline":true,"label":"release","permalink":"/preview-docs/es/changelog/tags/release"}],"hasTruncateMarker":true,"authors":[{"name":"Equipo SleakOps","title":"Equipo de Desarrollo","socials":{},"key":null,"page":null}],"frontMatter":{"title":"Versi\xf3n 2.3.2","slug":"v2-3-2","date":"2025-12-19T00:00:00.000Z","authors":[{"name":"Equipo SleakOps","title":"Equipo de Desarrollo"}],"tags":["release"]},"unlisted":false,"prevItem":{"title":"Versi\xf3n 2.4.0","permalink":"/preview-docs/es/changelog/2026/01/20/version-2.4.0"},"nextItem":{"title":"Versi\xf3n 2.3.1","permalink":"/preview-docs/es/changelog/v2-3-1"}},"content":"\x3c!--truncate--\x3e\\n\\n## Nuevas Funcionalidades\\n\\n- **CLI de SleakOps:** Mejoras y nuevas funcionalidades, incluyendo la posibilidad de abrir una shell de Workload de forma local.\\n- **S3 con CloudFront:** Mejoras en la integraci\xf3n de S3 con CloudFront.\\n- **Python en Lambdas:** Actualizaci\xf3n de versiones de Python para Lambdas.\\n- **Charts en Projects:** Mejoras en la pantalla de configuraci\xf3n de charts en Projects.\\n- **Tags de Subnet:** Mejoras en el manejo de tags de subnet para autodiscovery.\\n- **Restauraci\xf3n de DB:** Mejoras en el flujo de restauraci\xf3n de base de datos desde un snapshot.\\n- **Ingress en Web Services:** Soporte para configurar URL y anotaciones de ingress en Web Services.\\n- **Performance de APIs:** Optimizaci\xf3n del rendimiento de las APIs.\\n- **Errores de Dominios:** Mejoras en el manejo de errores de dominios.\\n- **Botones de Addons:** Mejoras visuales en los botones de addons.\\n- **Notificaciones:** Mejoras visuales al mostrar notificaciones.\\n- **Opciones de Botones:** Mejoras visuales en las opciones de botones (configuraci\xf3n, copiar, etc.).\\n- **Versiones de RDS:** Actualizaci\xf3n de versiones disponibles de RDS.\\n- **M\xf3dulos de Infraestructura:** Optimizaci\xf3n de tiempos de ejecuci\xf3n para m\xf3dulos de infraestructura.\\n\\n## Correcciones de Errores\\n\\n- **Eliminaci\xf3n de Roles:** Manejo de la eliminaci\xf3n de roles al eliminar un Project.\\n- **Facturaci\xf3n Multi-Proveedor:** Correcci\xf3n en la pantalla de facturaci\xf3n con m\xfaltiples proveedores.\\n- **Registro y Login:** Manejo del flujo de registro y login con diferentes estados de suscripciones.\\n- **Formulario de Nodepool:** Manejo de errores en el formulario de Nodepool.\\n- **Cambio de Cuentas:** Manejo de errores al cambiar entre cuentas.\\n- **Caracteres en Variables:** Manejo de caracteres inv\xe1lidos en nombres de variables en Variable Groups.\\n- **Acceso a Cluster:** Manejo del acceso a Cluster para diferentes tipos de usuarios.\\n- **Acceso a VPN:** Manejo de errores al obtener acceso a VPN para diferentes tipos de usuarios.\\n- **Textos en Listados:** Correcci\xf3n de textos en listados y formularios.\\n- **Conexi\xf3n con AWS:** Correcci\xf3n de textos en la gu\xeda paso a paso para conectarse con AWS.\\n- **Deployments Pendientes:** Indicador de alerta para deployments pendientes de aprobaci\xf3n.\\n- **Actualizaci\xf3n de Postgres:** Manejo de errores en la actualizaci\xf3n de PostgreSQL de 14 a 17.\\n- **Security Group de RDS:** Correcci\xf3n del security group para r\xe9plicas p\xfablicas y privadas de RDS.\\n- **Chat de Soporte:** Correcci\xf3n en la delegaci\xf3n en el chat de soporte."},{"id":"v2-3-1","metadata":{"permalink":"/preview-docs/es/changelog/v2-3-1","source":"@site/i18n/es/docusaurus-plugin-content-blog-changelog/2025-12-01-V2.3.1.md","title":"Versi\xf3n 2.3.1","description":"01/12/2025","date":"2025-12-01T00:00:00.000Z","tags":[{"inline":true,"label":"release","permalink":"/preview-docs/es/changelog/tags/release"}],"hasTruncateMarker":true,"authors":[],"frontMatter":{"title":"Versi\xf3n 2.3.1","slug":"v2-3-1","date":"2025-12-01T00:00:00.000Z","tags":["release"]},"unlisted":false,"prevItem":{"title":"Versi\xf3n 2.3.2","permalink":"/preview-docs/es/changelog/v2-3-2"},"nextItem":{"title":"Versi\xf3n 2.3.0","permalink":"/preview-docs/es/changelog/v2-3-0"}},"content":"\x3c!--truncate--\x3e\\n\\n01/12/2025\\n\\n## Nuevas Funcionalidades\\n\\n- **An\xe1lisis de Im\xe1genes en Soporte:** Soporte para an\xe1lisis de im\xe1genes en el bot de soporte.\\n- **Documentaci\xf3n:** Nueva documentaci\xf3n para Dockertron y gesti\xf3n de charts.\\n- **Valores Personalizados en Addons:** Capacidad de usar valores personalizados al instalar un addon.\\n- **Cambio de Nodegroup:** Capacidad de cambiar el nodegroup de clusters no productivos.\\n- **Flujo de Soporte:** Flujo de conversaci\xf3n para soporte entre bot y humano.\\n\\n## Correcciones de Errores\\n\\n- **Modales de Confirmaci\xf3n:** Correcci\xf3n de posici\xf3n de modales de confirmaci\xf3n de eliminaci\xf3n.\\n- **Tabla de Builds:** Correcci\xf3n de errores de datos y columnas en la tabla de builds.\\n- **Notificaciones del Dashboard:** Correcci\xf3n de mensajes de notificaci\xf3n en el dashboard.\\n- **Nombres de Workloads:** Ajuste de tama\xf1os de nombres para Workloads.\\n- **Dependencia de Chart:** Correcci\xf3n del flujo de dependencia de charts.\\n- **Alertas de Consola:** Correcci\xf3n de alertas de notificaci\xf3n en la consola."},{"id":"v2-3-0","metadata":{"permalink":"/preview-docs/es/changelog/v2-3-0","source":"@site/i18n/es/docusaurus-plugin-content-blog-changelog/2025-11-18-V2.3.0.md","title":"Versi\xf3n 2.3.0","description":"18/11/2025","date":"2025-11-18T00:00:00.000Z","tags":[{"inline":true,"label":"release","permalink":"/preview-docs/es/changelog/tags/release"}],"hasTruncateMarker":true,"authors":[],"frontMatter":{"title":"Versi\xf3n 2.3.0","slug":"v2-3-0","date":"2025-11-18T00:00:00.000Z","tags":["release"]},"unlisted":false,"prevItem":{"title":"Versi\xf3n 2.3.1","permalink":"/preview-docs/es/changelog/v2-3-1"},"nextItem":{"title":"Versi\xf3n 2.2.0","permalink":"/preview-docs/es/changelog/v2-2-0"}},"content":"\x3c!--truncate--\x3e\\n\\n18/11/2025\\n\\n## Nuevas Funcionalidades\\n\\n- **Clonaci\xf3n de Environments:** Nueva funci\xf3n para clonar Environments.\\n- **Clonaci\xf3n de Projects:** Nueva funci\xf3n para clonar Projects.\\n- **Clonaci\xf3n de Dependencies:** Nueva funci\xf3n para clonar Dependencies.\\n- **Clonaci\xf3n de Workloads:** Nueva funci\xf3n para clonar Workloads.\\n- **Clonaci\xf3n de Variable Groups:** Nueva funci\xf3n para clonar Variable Groups.\\n- **Filtros de Monitoreo de Cluster:** Agregados filtros para navegar eventos de Cluster en Cluster Monitoring.\\n- **B\xfasqueda de Variable Groups:** Capacidad de buscar Variable Groups por nombres de claves internas desde la b\xfasqueda general.\\n\\n## Correcciones de Errores\\n\\n- **Cuenta Seleccionada:** La cuenta seleccionada ahora persiste al cambiar de usuario.\\n- **Apagado de Web Services:** Mejoras en el apagado de Web Services."},{"id":"v2-2-0","metadata":{"permalink":"/preview-docs/es/changelog/v2-2-0","source":"@site/i18n/es/docusaurus-plugin-content-blog-changelog/2025-11-13-V2.2.0.md","title":"Versi\xf3n 2.2.0","description":"13/11/2025","date":"2025-11-13T00:00:00.000Z","tags":[{"inline":true,"label":"release","permalink":"/preview-docs/es/changelog/tags/release"}],"hasTruncateMarker":true,"authors":[],"frontMatter":{"title":"Versi\xf3n 2.2.0","slug":"v2-2-0","date":"2025-11-13T00:00:00.000Z","tags":["release"]},"unlisted":false,"prevItem":{"title":"Versi\xf3n 2.3.0","permalink":"/preview-docs/es/changelog/v2-3-0"},"nextItem":{"title":"Versi\xf3n 2.1.0","permalink":"/preview-docs/es/changelog/v2-1-0"}},"content":"\x3c!--truncate--\x3e\\n\\n13/11/2025\\n\\n## Nuevas Funcionalidades\\n\\n- **Visor de C\xf3digo:** Nuevo componente para visualizar c\xf3digo dentro de la consola.\\n\\n## Correcciones de Errores\\n\\n- **Usuarios Eliminados:** Correcci\xf3n de errores con usuarios eliminados.\\n- **Actualizaci\xf3n de Ramas:** Correcci\xf3n del flujo para actualizar ramas en Project.\\n- **Informaci\xf3n Incompleta:** Correcci\xf3n del flujo cuando la informaci\xf3n del Project est\xe1 incompleta.\\n- **Pol\xedticas Extra:** Correcci\xf3n del flujo para configurar pol\xedticas extra en Project."},{"id":"v2-1-0","metadata":{"permalink":"/preview-docs/es/changelog/v2-1-0","source":"@site/i18n/es/docusaurus-plugin-content-blog-changelog/2025-11-10-V2.1.0.md","title":"Versi\xf3n 2.1.0","description":"10/11/2025","date":"2025-11-10T00:00:00.000Z","tags":[{"inline":true,"label":"release","permalink":"/preview-docs/es/changelog/tags/release"}],"hasTruncateMarker":true,"authors":[],"frontMatter":{"title":"Versi\xf3n 2.1.0","slug":"v2-1-0","date":"2025-11-10T00:00:00.000Z","tags":["release"]},"unlisted":false,"prevItem":{"title":"Versi\xf3n 2.2.0","permalink":"/preview-docs/es/changelog/v2-2-0"},"nextItem":{"title":"Versi\xf3n 2.0.1","permalink":"/preview-docs/es/changelog/v2-0-1"}},"content":"\x3c!--truncate--\x3e\\n\\n10/11/2025\\n\\n## Nuevas Funcionalidades\\n\\n- **Actualizaci\xf3n de Cluster:** Soporte para actualizaci\xf3n de Cluster de 1.31 a 1.32.\\n- **Tour de Dependencies:** Nuevo tour guiado para la pantalla de Dependencies.\\n- **Tour de Workloads:** Nuevo tour guiado para la pantalla de Workloads.\\n- **Tour de Variable Groups:** Nuevo tour guiado para la pantalla de Variable Groups.\\n- **Tour de Cluster:** Nuevo tour guiado para la pantalla de Cluster.\\n- **Tour de Projects:** Nuevo tour guiado para la pantalla de Projects.\\n- **Optimizaci\xf3n de Actualizaci\xf3n de Cluster:** Optimizaci\xf3n de tareas de actualizaci\xf3n de Cluster.\\n- **Carga de Pantallas:** Mejoras en la carga de drawers y pantallas secundarias.\\n- **Actualizaci\xf3n Programada:** Nuevo flujo para programar actualizaciones de Cluster.\\n- **Onboarding:** Nuevo flujo de onboarding para usuarios nuevos.\\n- **Configuraci\xf3n de Nodepool:** Soporte para m\xe1s par\xe1metros de configuraci\xf3n de Nodepool (tipos de instancia, fallbacks, etc.).\\n- **Monitoreo de Actualizaci\xf3n:** Nuevo flujo de monitoreo de servicios durante la actualizaci\xf3n de Cluster con reporte de errores.\\n- **Logs de Builds:** Mejoras en logs de builds con m\xe1s contexto.\\n\\n## Correcciones de Errores\\n\\n- **Certificado SSL para S3:** Correcci\xf3n de errores de certificado SSL para S3 con CloudFront.\\n- **Logs de Actividad:** Correcci\xf3n de nombres en algunos Logs de Actividad.\\n- **Creaci\xf3n de Usuarios:** Correcci\xf3n de errores en el flujo de creaci\xf3n de usuarios.\\n- **Tickets de Soporte:** Correcci\xf3n del estado de tickets de soporte.\\n- **Build con CLI:** Correcci\xf3n de par\xe1metros al construir usando el CLI.\\n- **Apagado Nocturno:** Correcci\xf3n del estado de Cluster con apagado nocturno habilitado.\\n- **Resoluciones de Pantalla:** Ajustes para algunas resoluciones en la pantalla principal de la consola.\\n- **Eliminar Web Services:** Correcci\xf3n de errores al eliminar un Web Service desde la tabla."},{"id":"v2-0-1","metadata":{"permalink":"/preview-docs/es/changelog/v2-0-1","source":"@site/i18n/es/docusaurus-plugin-content-blog-changelog/2025-10-15-V2.0.1.md","title":"Versi\xf3n 2.0.1","description":"15/10/2025","date":"2025-10-15T00:00:00.000Z","tags":[{"inline":true,"label":"release","permalink":"/preview-docs/es/changelog/tags/release"}],"hasTruncateMarker":true,"authors":[],"frontMatter":{"title":"Versi\xf3n 2.0.1","slug":"v2-0-1","date":"2025-10-15T00:00:00.000Z","tags":["release"]},"unlisted":false,"prevItem":{"title":"Versi\xf3n 2.1.0","permalink":"/preview-docs/es/changelog/v2-1-0"},"nextItem":{"title":"Versi\xf3n 2.0.0","permalink":"/preview-docs/es/changelog/v2-0-0"}},"content":"\x3c!--truncate--\x3e\\n\\n15/10/2025\\n\\n## Nuevas Funcionalidades\\n\\n- **Tabla de Builds y Deploys:** Mejoras en los datos mostrados en la tabla de builds y deploys.\\n\\n## Correcciones de Errores\\n\\n- **Cron de Apagado Nocturno:** Correcci\xf3n de visualizaci\xf3n del cron de apagado nocturno.\\n- **Estado de Cluster:** Correcci\xf3n de actualizaci\xf3n del estado de Cluster durante la actualizaci\xf3n.\\n- **Notificaciones Largas:** Correcci\xf3n de visualizaci\xf3n de notificaciones largas.\\n- **VPN de Terceros:** Correcci\xf3n de acceso VPN para terceros.\\n- **Cancelaci\xf3n de Deploy:** Correcci\xf3n del flujo de cancelaci\xf3n de deploy.\\n- **Creaci\xf3n de Provider:** Correcci\xf3n de jerarqu\xedas de texto en el flujo de creaci\xf3n de Provider.\\n- **Informaci\xf3n Faltante:** Correcci\xf3n de redirecci\xf3n en el flujo de informaci\xf3n faltante para Project.\\n- **Usuario Viewer:** Correcci\xf3n de navegaci\xf3n para usuarios viewer.\\n- **Toggles de Modo Claro:** Mejora de visibilidad de toggles en modo claro.\\n- **Contrase\xf1a de Dependency MQ:** Correcci\xf3n de auto-generaci\xf3n de contrase\xf1a para Dependency MQ.\\n- **Carga de Iconos:** Mejoras en la carga de iconos.\\n- **Pantallas de Transici\xf3n:** Correcci\xf3n de pantallas de transici\xf3n durante la carga de datos.\\n- **Tablas de Consola de Project:** Mejora de visualizaci\xf3n de tablas en la pantalla \\"Consola de Project\\".\\n- **Errores de Infraestructura:** Correcci\xf3n de mensajes de error cuando falla la ejecuci\xf3n de m\xf3dulos de infraestructura.\\n- **Selector de Cuenta M\xf3vil:** Soporte para selector de cuenta en dispositivos m\xf3viles."},{"id":"v2-0-0","metadata":{"permalink":"/preview-docs/es/changelog/v2-0-0","source":"@site/i18n/es/docusaurus-plugin-content-blog-changelog/2025-10-01-V2.0.0.md","title":"Versi\xf3n 2.0.0","description":"01/10/2025","date":"2025-10-01T00:00:00.000Z","tags":[{"inline":true,"label":"release","permalink":"/preview-docs/es/changelog/tags/release"}],"hasTruncateMarker":true,"authors":[],"frontMatter":{"title":"Versi\xf3n 2.0.0","slug":"v2-0-0","date":"2025-10-01T00:00:00.000Z","tags":["release"]},"unlisted":false,"prevItem":{"title":"Versi\xf3n 2.0.1","permalink":"/preview-docs/es/changelog/v2-0-1"},"nextItem":{"title":"Versi\xf3n 1.7.16","permalink":"/preview-docs/es/changelog/v1-7-16"}},"content":"\x3c!--truncate--\x3e\\n\\n01/10/2025\\n\\n## Nuevas Funcionalidades\\n\\n- **Redise\xf1o Completo de Consola:** UI modernizada para una experiencia m\xe1s limpia e intuitiva.\\n- **Soporte para Tema Claro:** Soporte completo para modo claro.\\n- **Bot de Soporte:** Respuestas automatizadas para preguntas comunes de soporte.\\n- **Documentaci\xf3n Integral:** Gu\xedas ampliadas cubriendo todas las funcionalidades.\\n- **Actualizaci\xf3n de lambdas:** Actualizaci\xf3n de versiones de Python para lambdas.\\n- **Project Chart:** Promovido a estable.\\n- **Project Access:** Promovido a estable.\\n- **Dependency Aurora MySQL:** Promovido a estable.\\n- **Dependency Oracle:** Promovido a estable.\\n- **Dependency MariaDB:** Promovido a estable.\\n- **Dependency Aurora PostgreSQL:** Promovido a estable.\\n- **Edici\xf3n de Dependencies:** Capacidad de editar dependencies existentes.\\n- **Dockertron (beta):** Dockerizaci\xf3n autom\xe1tica impulsada por IA.\\n- **Cancelaci\xf3n de Builds:** Posibilidad de cancelar builds pendientes.\\n- **Nueva Dependency MSK:** Soporte para Kafka v\xeda AWS MSK.\\n- **Webservices Mejorados:** Configurar anotaciones de ingress personalizadas y healthchecks opcionales.\\n- **Nodepools Avanzados:** Nuevas estrategias de fallback y mezcla de instancias (reservadas, spot, on-demand) para mejor control de costos y rendimiento.\\n\\n## Correcciones de Errores\\n\\n- **GitLab self-hosted:** Correcci\xf3n de validaci\xf3n de URL.\\n- **Eliminaci\xf3n de Cluster:** Mejoras en el manejo de eliminaci\xf3n en cascada."},{"id":"v1-7-16","metadata":{"permalink":"/preview-docs/es/changelog/v1-7-16","source":"@site/i18n/es/docusaurus-plugin-content-blog-changelog/2025-07-21-V1.7.16.md","title":"Versi\xf3n 1.7.16","description":"21/07/2025","date":"2025-07-21T00:00:00.000Z","tags":[{"inline":true,"label":"release","permalink":"/preview-docs/es/changelog/tags/release"}],"hasTruncateMarker":true,"authors":[],"frontMatter":{"title":"Versi\xf3n 1.7.16","slug":"v1-7-16","date":"2025-07-21T00:00:00.000Z","tags":["release"]},"unlisted":false,"prevItem":{"title":"Versi\xf3n 2.0.0","permalink":"/preview-docs/es/changelog/v2-0-0"},"nextItem":{"title":"Versi\xf3n 1.7.15","permalink":"/preview-docs/es/changelog/v1-7-15"}},"content":"\x3c!--truncate--\x3e\\n\\n21/07/2025\\n\\n## Nuevas Funcionalidades\\n\\n- **Projects con Repositorios P\xfablicos:** Ahora puedes crear y gestionar proyectos vinculados a repositorios p\xfablicos.\\n- **Excluir Builds de M\xe9tricas:** Los builds pueden excluirse del dashboard de m\xe9tricas de Grafana para reportes m\xe1s precisos.\\n\\n## Correcciones de Errores\\n\\n- **Deployments de Nuevos Projects:** Correcci\xf3n de problemas que imped\xedan el despliegue exitoso de proyectos reci\xe9n creados."},{"id":"v1-7-15","metadata":{"permalink":"/preview-docs/es/changelog/v1-7-15","source":"@site/i18n/es/docusaurus-plugin-content-blog-changelog/2025-07-07-V1.7.15.md","title":"Versi\xf3n 1.7.15","description":"07/07/2025","date":"2025-07-07T00:00:00.000Z","tags":[{"inline":true,"label":"release","permalink":"/preview-docs/es/changelog/tags/release"}],"hasTruncateMarker":true,"authors":[],"frontMatter":{"title":"Versi\xf3n 1.7.15","slug":"v1-7-15","date":"2025-07-07T00:00:00.000Z","tags":["release"]},"unlisted":false,"prevItem":{"title":"Versi\xf3n 1.7.16","permalink":"/preview-docs/es/changelog/v1-7-16"},"nextItem":{"title":"Versi\xf3n 1.7.14","permalink":"/preview-docs/es/changelog/v1-7-14"}},"content":"\x3c!--truncate--\x3e\\n\\n07/07/2025\\n\\n## Nuevas Funcionalidades\\n\\n- **Resiliencia de Nodegroup Spot:** Los nodegroups Spot ahora previenen fallos cuando no hay instancias Spot disponibles.\\n- **VariableGroups Basados en Archivos:** Agregado soporte para crear variablegroups de tipo archivo.\\n- **Agent Bot (beta):** Bot agente experimental lanzado en beta.\\n\\n## Correcciones de Errores\\n\\n- **Configuraci\xf3n de dominio dependiente:** Generar registros DNS cuando el dominio padre ya est\xe1 creado.\\n- **Estado de Cluster con apagado nocturno:** Correcci\xf3n de visualizaci\xf3n incorrecta del estado para clusters con apagado nocturno habilitado.\\n- **Filtros de VariableGroups:** Filtrar por proyectos en la lista de variablegroups.\\n- **Eliminar cluster:** Correcci\xf3n del flujo de eliminaci\xf3n de cluster.\\n- **Estado de ticket de soporte:** Correcci\xf3n del estado de cierre de ticket de soporte."},{"id":"v1-7-14","metadata":{"permalink":"/preview-docs/es/changelog/v1-7-14","source":"@site/i18n/es/docusaurus-plugin-content-blog-changelog/2025-06-26-V1.7.14.md","title":"Versi\xf3n 1.7.14","description":"26/06/2025","date":"2025-06-26T00:00:00.000Z","tags":[{"inline":true,"label":"release","permalink":"/preview-docs/es/changelog/tags/release"}],"hasTruncateMarker":true,"authors":[],"frontMatter":{"title":"Versi\xf3n 1.7.14","slug":"v1-7-14","date":"2025-06-26T00:00:00.000Z","tags":["release"]},"unlisted":false,"prevItem":{"title":"Versi\xf3n 1.7.15","permalink":"/preview-docs/es/changelog/v1-7-15"},"nextItem":{"title":"Versi\xf3n 1.7.13","permalink":"/preview-docs/es/changelog/v1-7-13"}},"content":"\x3c!--truncate--\x3e\\n\\n26/06/2025\\n\\n## Nuevas Funcionalidades\\n\\n- **Mejoras en Transiciones de Estado:** Cambios de estado m\xe1s fluidos para addons de cluster y formularios.\\n- **Soporte con Im\xe1genes:** Los usuarios ahora pueden subir im\xe1genes en el chat de soporte.\\n- **Jobs desde Cronjobs o Jobs Existentes:** Capacidad de lanzar un Job desde un cronjob o Job existente.\\n- **Errores de Infraestructura:** Mejora en el an\xe1lisis y visualizaci\xf3n de errores de infraestructura para facilitar la resoluci\xf3n de problemas.\\n\\n## Correcciones de Errores\\n\\n- **Vol\xfamenes Duplicados:** Correcci\xf3n del problema al crear vol\xfamenes con el mismo nombre.\\n- **Usuarios Duplicados:** Prevenci\xf3n de creaci\xf3n de usuarios con el mismo email.\\n- **Dependencies Duplicadas:** Bloqueo de creaci\xf3n de dependencies con nombres duplicados.\\n- **Monitoreo de Dependencies:** Correcci\xf3n de problemas de rango de fechas en la pantalla de monitoreo de dependencies."},{"id":"v1-7-13","metadata":{"permalink":"/preview-docs/es/changelog/v1-7-13","source":"@site/i18n/es/docusaurus-plugin-content-blog-changelog/2025-06-02-V1.7.13.md","title":"Versi\xf3n 1.7.13","description":"02/06/2025","date":"2025-06-02T00:00:00.000Z","tags":[{"inline":true,"label":"release","permalink":"/preview-docs/es/changelog/tags/release"}],"hasTruncateMarker":true,"authors":[],"frontMatter":{"title":"Versi\xf3n 1.7.13","slug":"v1-7-13","date":"2025-06-02T00:00:00.000Z","tags":["release"]},"unlisted":false,"prevItem":{"title":"Versi\xf3n 1.7.14","permalink":"/preview-docs/es/changelog/v1-7-14"},"nextItem":{"title":"Versi\xf3n 1.7.12","permalink":"/preview-docs/es/changelog/v1-7-12"}},"content":"\x3c!--truncate--\x3e\\n\\n02/06/2025\\n\\n## Nuevas Funcionalidades\\n\\n- **Monitoreo de Dependencies:** Mejora en visualizaci\xf3n y seguimiento de dependencies.\\n- **Control de Servicios:** Nuevo toggle para encender o apagar webservices y workers.\\n- **Builds con o sin cach\xe9:** Opci\xf3n para ejecutar builds usando cach\xe9 o desde cero.\\n- **Importaci\xf3n de Bucket S3 con Versionado:** Agregado soporte para importar Buckets S3 con versionado activo.\\n- **Variable Groups:** Interfaz mejorada para gestionar grupos de variables.\\n- **Validaci\xf3n de Dockerfile:** Nuevas validaciones para asegurar la confiabilidad de Dockerfiles.\\n\\n## Correcciones de Errores\\n\\n- **Logs de Jobs:** Correcci\xf3n de enlaces rotos de logs para Jobs.\\n- **Nombres de Ramas:** Agregado soporte para ramas con / en sus nombres.\\n- **Pipelines de GitLab:** Correcci\xf3n de problemas que afectaban la ejecuci\xf3n de pipelines."},{"id":"v1-7-12","metadata":{"permalink":"/preview-docs/es/changelog/v1-7-12","source":"@site/i18n/es/docusaurus-plugin-content-blog-changelog/2025-05-14-V1.7.12.md","title":"Versi\xf3n 1.7.12","description":"14/05/2025","date":"2025-05-14T00:00:00.000Z","tags":[{"inline":true,"label":"release","permalink":"/preview-docs/es/changelog/tags/release"}],"hasTruncateMarker":true,"authors":[],"frontMatter":{"title":"Versi\xf3n 1.7.12","slug":"v1-7-12","date":"2025-05-14T00:00:00.000Z","tags":["release"]},"unlisted":false,"prevItem":{"title":"Versi\xf3n 1.7.13","permalink":"/preview-docs/es/changelog/v1-7-13"},"nextItem":{"title":"Versi\xf3n 1.7.11","permalink":"/preview-docs/es/changelog/v1-7-11"}},"content":"\x3c!--truncate--\x3e\\n\\n14/05/2025\\n\\n## Nuevas Funcionalidades\\n\\n- **Nuevo Flujo de Soporte:** Introducido un chatbot de soporte y sistema de tickets para proporcionar mejor trazabilidad y tiempos de respuesta m\xe1s r\xe1pidos.\\n- **Gesti\xf3n de Suscripciones y Planes:** Herramientas mejoradas para gestionar suscripciones y planes de servicio.\\n\\n## Correcciones de Errores\\n\\n- **Mejoras en Formularios:** Mejoras generales en usabilidad y validaci\xf3n de formularios.\\n- **Consola de Project:** Mejoras de UI/UX en la pantalla de consola de proyecto."},{"id":"v1-7-11","metadata":{"permalink":"/preview-docs/es/changelog/v1-7-11","source":"@site/i18n/es/docusaurus-plugin-content-blog-changelog/2025-04-24-V1.7.11.md","title":"Versi\xf3n 1.7.11","description":"24/04/2025","date":"2025-04-24T00:00:00.000Z","tags":[{"inline":true,"label":"release","permalink":"/preview-docs/es/changelog/tags/release"}],"hasTruncateMarker":true,"authors":[],"frontMatter":{"title":"Versi\xf3n 1.7.11","slug":"v1-7-11","date":"2025-04-24T00:00:00.000Z","tags":["release"]},"unlisted":false,"prevItem":{"title":"Versi\xf3n 1.7.12","permalink":"/preview-docs/es/changelog/v1-7-12"},"nextItem":{"title":"Versi\xf3n 1.7.10","permalink":"/preview-docs/es/changelog/v1-7-10"}},"content":"\x3c!--truncate--\x3e\\n\\n24/04/2025\\n\\n## Nuevas Funcionalidades\\n\\n- **Kubernetes 1.31 & Karpenter 1.3:** SleakOps ahora provisiona clusters en EKS 1.31 y actualiza el autoscaler a Karpenter 1.3.\\n- **Gesti\xf3n de Secretos M\xe1s Fuerte:** Todos los secretos ahora tambi\xe9n se almacenan encriptados en AWS Systems Manager Parameter Store, agregando una capa adicional de durabilidad m\xe1s all\xe1 de la copia en-cluster.\\n\\n## Correcciones de Errores\\n\\n- **Workers de Dev-Cluster:** Eliminado el PodDisruptionBudget mejorando la confiabilidad de workers en clusters de desarrollo cuando el cluster ten\xeda el scheduler de apagado habilitado.\\n- **Builds:** Los builds ya no se activan por cada edici\xf3n menor de proyecto.\\n- **Deployments:** Cambiados los jobs de deployments fuera de Fargate; los logs de builds ahora se persisten para facilitar la resoluci\xf3n de problemas.\\n- **Detalles de Web Service:** Refinada la p\xe1gina de detalles del servicio para mejor visibilidad de endpoints, estado y m\xe9tricas.\\n- **Add-on de Kubecost:** Mejoras de estabilidad."},{"id":"v1-7-10","metadata":{"permalink":"/preview-docs/es/changelog/v1-7-10","source":"@site/i18n/es/docusaurus-plugin-content-blog-changelog/2025-04-01-V1.7.10.md","title":"Versi\xf3n 1.7.10","description":"01/04/2025","date":"2025-04-01T00:00:00.000Z","tags":[{"inline":true,"label":"release","permalink":"/preview-docs/es/changelog/tags/release"}],"hasTruncateMarker":true,"authors":[],"frontMatter":{"title":"Versi\xf3n 1.7.10","slug":"v1-7-10","date":"2025-04-01T00:00:00.000Z","tags":["release"]},"unlisted":false,"prevItem":{"title":"Versi\xf3n 1.7.11","permalink":"/preview-docs/es/changelog/v1-7-11"},"nextItem":{"title":"Versi\xf3n 1.7.9","permalink":"/preview-docs/es/changelog/v1-7-9"}},"content":"\x3c!--truncate--\x3e\\n\\n01/04/2025\\n\\n## Nuevas Funcionalidades\\n\\n- **Control de Permisos Mejorado:** Los proyectos ahora pueden tener permisos adicionales asociados, ya sean Pol\xedticas IAM de AWS o permisos personalizados.\\n- **Detalles de Dependencies:** Los detalles de configuraci\xf3n de cada dependency ahora se muestran dentro de su vista de detalle.\\n- **Mejoras en Pantalla de Actualizaci\xf3n de Cluster:** El an\xe1lisis de EKS Insights ahora se incluye directamente en SleakOps para agilizar las actualizaciones de cluster.\\n- **Mejoras en Builds y Projects:** Informaci\xf3n adicional durante builds y flujos de trabajo de validaci\xf3n de proyectos mejorados.\\n\\n## Correcciones de Errores\\n\\n- **Entrada de Texto Mejorada:** Resueltos problemas que afectaban las entradas de texto en formularios.\\n- **Datos de Acceso a Cluster:** Correcci\xf3n de un bug al recuperar datos de conexi\xf3n de cluster bajo una cuenta seleccionada diferente.\\n- **Filtros de Lista de Dominios:** Agregados filtros por cuenta a la lista de dominios.\\n- **Mejoras en Lista de Nodepool:** Refinados los visuales para la vista de lista de nodepool.\\n- **Actualizaciones de Instalaci\xf3n de Add-ons:** La lista de add-ons ahora se actualiza correctamente despu\xe9s de la instalaci\xf3n.\\n- **Edici\xf3n de Variable Groups:** Correcci\xf3n de un problema con la edici\xf3n de grupos de variables.\\n- **Adjunto de Suscripci\xf3n:** Solucionado un bug que imped\xeda que nuevas suscripciones se adjuntaran correctamente.\\n- **Pron\xf3stico de Costos:** Correcci\xf3n de problemas de pron\xf3stico para mejores estimaciones de costos."},{"id":"v1-7-9","metadata":{"permalink":"/preview-docs/es/changelog/v1-7-9","source":"@site/i18n/es/docusaurus-plugin-content-blog-changelog/2025-02-17-V1.7.9.md","title":"Versi\xf3n 1.7.9","description":"17/02/2025","date":"2025-02-17T00:00:00.000Z","tags":[{"inline":true,"label":"release","permalink":"/preview-docs/es/changelog/tags/release"}],"hasTruncateMarker":true,"authors":[],"frontMatter":{"title":"Versi\xf3n 1.7.9","slug":"v1-7-9","date":"2025-02-17T00:00:00.000Z","tags":["release"]},"unlisted":false,"prevItem":{"title":"Versi\xf3n 1.7.10","permalink":"/preview-docs/es/changelog/v1-7-10"},"nextItem":{"title":"Versi\xf3n 1.7.8","permalink":"/preview-docs/es/changelog/v1-7-8"}},"content":"\x3c!--truncate--\x3e\\n\\n17/02/2025\\n\\n## Nuevas Funcionalidades\\n\\n- **Mejoras en Cronjobs:** Configurar pol\xedticas de cronjob y filtrar f\xe1cilmente entre cronjobs activos e inactivos.\\n- **Emails de Soporte en Notificaciones:** Cuando SleakOps genera una notificaci\xf3n, los usuarios ahora la reciben por email.\\n- **EKS Insights:** Durante las actualizaciones de cluster, SleakOps verifica EKS Insights para asegurar que todo funcione correctamente.\\n\\n## Correcciones de Errores\\n\\n- **Mejoras en Flujo de Project:** Mejorados varios ajustes, formularios y otros elementos para una gesti\xf3n de proyectos m\xe1s fluida.\\n- **Flujo de Creaci\xf3n de Cuenta AWS:** Ahora soporta cuentas AWS inactivas, proporcionando orientaci\xf3n clara sobre c\xf3mo activarlas manualmente antes de reanudar el proceso en SleakOps."},{"id":"v1-7-8","metadata":{"permalink":"/preview-docs/es/changelog/v1-7-8","source":"@site/i18n/es/docusaurus-plugin-content-blog-changelog/2025-02-10-V1.7.8.md","title":"Versi\xf3n 1.7.8","description":"10/02/2025","date":"2025-02-10T00:00:00.000Z","tags":[{"inline":true,"label":"release","permalink":"/preview-docs/es/changelog/tags/release"}],"hasTruncateMarker":true,"authors":[],"frontMatter":{"title":"Versi\xf3n 1.7.8","slug":"v1-7-8","date":"2025-02-10T00:00:00.000Z","tags":["release"]},"unlisted":false,"prevItem":{"title":"Versi\xf3n 1.7.9","permalink":"/preview-docs/es/changelog/v1-7-9"},"nextItem":{"title":"Versi\xf3n 1.7.7","permalink":"/preview-docs/es/changelog/v1-7-7"}},"content":"\x3c!--truncate--\x3e\\n\\n10/02/2025\\n\\n## Nuevas Funcionalidades\\n\\n- **Kubernetes 1.30:** Actualizado soporte de EKS a la versi\xf3n 1.30.\\n\\n## Correcciones de Errores\\n\\n- **Mejoras Menores de UI:** Mejorado el dise\xf1o visual para pantallas de proyecto y workload."},{"id":"v1-7-7","metadata":{"permalink":"/preview-docs/es/changelog/v1-7-7","source":"@site/i18n/es/docusaurus-plugin-content-blog-changelog/2025-02-05-V1.7.7.md","title":"Versi\xf3n 1.7.7","description":"05/02/2025","date":"2025-02-05T00:00:00.000Z","tags":[{"inline":true,"label":"release","permalink":"/preview-docs/es/changelog/tags/release"}],"hasTruncateMarker":true,"authors":[],"frontMatter":{"title":"Versi\xf3n 1.7.7","slug":"v1-7-7","date":"2025-02-05T00:00:00.000Z","tags":["release"]},"unlisted":false,"prevItem":{"title":"Versi\xf3n 1.7.8","permalink":"/preview-docs/es/changelog/v1-7-8"},"nextItem":{"title":"Versi\xf3n 1.7.6","permalink":"/preview-docs/es/changelog/v1-7-6"}},"content":"\x3c!--truncate--\x3e\\n\\n05/02/2025\\n\\n## Nuevas Funcionalidades\\n\\n- **Importaci\xf3n desde Buckets Externos:** Copiar r\xe1pidamente archivos desde un Bucket S3 externo a SleakOps mediante la nueva funci\xf3n Import Bucket.\\n- **Revisi\xf3n de Vista de Project:** Ver logs e informaci\xf3n clave en una sola pantalla para mejor visibilidad.\\n- **Executions Renombrados a Workloads:** Terminolog\xeda actualizada para alinearse con la notaci\xf3n interna de cluster.\\n- **Optimizaci\xf3n de Eliminaci\xf3n de Cluster:** Agregada validaci\xf3n adicional para un proceso de eliminaci\xf3n m\xe1s seguro y estable.\\n\\n## Correcciones de Errores\\n\\n- **Permisos de Project para Jobs:** Correcci\xf3n de un problema donde los Jobs usaban permisos de nodo de cluster en lugar de permisos de Project.\\n- **Modificaci\xf3n de Docker Args:** Los builds ahora aplican correctamente cualquier Docker Args cambiado justo antes de ejecutarse.\\n- **Generaci\xf3n de Perfil VPN:** Resuelto un problema que imped\xeda que los perfiles de usuario de terceros se generaran exitosamente."},{"id":"v1-7-6","metadata":{"permalink":"/preview-docs/es/changelog/v1-7-6","source":"@site/i18n/es/docusaurus-plugin-content-blog-changelog/2025-01-06-V1.7.6.md","title":"Versi\xf3n 1.7.6","description":"06/01/2025","date":"2025-01-06T00:00:00.000Z","tags":[{"inline":true,"label":"release","permalink":"/preview-docs/es/changelog/tags/release"}],"hasTruncateMarker":true,"authors":[],"frontMatter":{"title":"Versi\xf3n 1.7.6","slug":"v1-7-6","date":"2025-01-06T00:00:00.000Z","tags":["release"]},"unlisted":false,"prevItem":{"title":"Versi\xf3n 1.7.7","permalink":"/preview-docs/es/changelog/v1-7-7"},"nextItem":{"title":"Versi\xf3n 1.7.5","permalink":"/preview-docs/es/changelog/v1-7-5"}},"content":"\x3c!--truncate--\x3e\\n\\n06/01/2025\\n\\n## Nuevas Funcionalidades\\n\\n- **Nuevas Configuraciones de Nodepool**: Ahora puedes establecer par\xe1metros adicionales, como tama\xf1os m\xednimos de instancia y m\xe1s.\\n- **Job con Im\xe1genes Espec\xedficas**: Al crear un job, puedes especificar la imagen exacta y el tag que deseas ejecutar (ej: `postgres:16.4`).\\n- **(BETA) Extensi\xf3n de Chart por Project**: SleakOps ahora puede extender los charts usados para desplegar workloads de proyecto, permiti\xe9ndote agregar dependencies. Para m\xe1s informaci\xf3n, consulta la [documentaci\xf3n de Helm](https://helm.sh/docs/helm/helm_dependency/).\\n- **Mejoras en CI/CD**: El archivo para configurar CI/CD ha sido simplificado y optimizado.\\n\\n## Correcciones de Errores\\n\\n- **URL de Web Service Interna**: Correcci\xf3n de un problema que causaba URLs incorrectas para web services de tipo \\"interno\\".\\n- **Eliminaci\xf3n de Volumen**: Resueltos problemas relacionados con la eliminaci\xf3n de vol\xfamenes bajo varias pol\xedticas de retenci\xf3n.\\n- **Mejoras de UX/UI**: Mejoras en la interfaz para Projects, Volumes y Variable Groups."},{"id":"v1-7-5","metadata":{"permalink":"/preview-docs/es/changelog/v1-7-5","source":"@site/i18n/es/docusaurus-plugin-content-blog-changelog/2024-12-09-V1.7.5.md","title":"Versi\xf3n 1.7.5","description":"09/12/2024","date":"2024-12-09T00:00:00.000Z","tags":[{"inline":true,"label":"release","permalink":"/preview-docs/es/changelog/tags/release"}],"hasTruncateMarker":true,"authors":[],"frontMatter":{"title":"Versi\xf3n 1.7.5","slug":"v1-7-5","date":"2024-12-09T00:00:00.000Z","tags":["release"]},"unlisted":false,"prevItem":{"title":"Versi\xf3n 1.7.6","permalink":"/preview-docs/es/changelog/v1-7-6"},"nextItem":{"title":"Versi\xf3n 1.7.4","permalink":"/preview-docs/es/changelog/v1-7-4"}},"content":"\x3c!--truncate--\x3e\\n\\n09/12/2024\\n\\n## Nuevas Funcionalidades\\n\\n- **Manejo de Errores de Integraci\xf3n AWS:**: Implementado un mecanismo para manejar retrasos en activaciones de cuentas AWS creadas por SleakOps.\\n- **Enlaces de Add-on en Builds:** Agregados enlaces para visualizar f\xe1cilmente logs y m\xe9tricas durante el proceso de build."},{"id":"v1-7-4","metadata":{"permalink":"/preview-docs/es/changelog/v1-7-4","source":"@site/i18n/es/docusaurus-plugin-content-blog-changelog/2024-12-05-V1.7.4.md","title":"Versi\xf3n 1.7.4","description":"05/12/2024","date":"2024-12-05T00:00:00.000Z","tags":[{"inline":true,"label":"release","permalink":"/preview-docs/es/changelog/tags/release"}],"hasTruncateMarker":true,"authors":[],"frontMatter":{"title":"Versi\xf3n 1.7.4","slug":"v1-7-4","date":"2024-12-05T00:00:00.000Z","tags":["release"]},"unlisted":false,"prevItem":{"title":"Versi\xf3n 1.7.5","permalink":"/preview-docs/es/changelog/v1-7-5"},"nextItem":{"title":"Versi\xf3n 1.7.3","permalink":"/preview-docs/es/changelog/v1-7-3"}},"content":"\x3c!--truncate--\x3e\\n\\n05/12/2024\\n\\n## Nuevas Funcionalidades\\n\\n- **Accesibilidad de Add-on:** Agregados enlaces en SleakOps para f\xe1cil acceso a visualizar logs, APM o m\xe9tricas para recursos espec\xedficos.\\n- **OpenTelemetry (Beta):** Introducido un add-on para mejorar la observabilidad en aplicaciones desplegadas con SleakOps. Con OpenTelemetry, puedes tener tu propio APM para monitorear m\xe9tricas como tasa de solicitudes, latencia y tasa de errores de tu aplicaci\xf3n.\\n- **Configuraciones de Disponibilidad de Add-on:** Agregadas varias configuraciones de disponibilidad para cada add-on.\\n- **Documentaci\xf3n:** Actualizada la documentaci\xf3n de add-ons y disponible en espa\xf1ol.\\n\\n## Correcciones de Errores\\n\\n- **Revisi\xf3n de Integraci\xf3n Kubecost:** Revisada la integraci\xf3n Prometheus-Kubecost. Kubecost ahora mapea correctamente los nombres de recursos desplegados a sus costos, mejorando enormemente la precisi\xf3n de sus estimaciones. Ahora es posible habilitar an\xe1lisis aproximado de costos de tr\xe1fico de red dentro del cluster en Kubecost (Beta)."},{"id":"v1-7-3","metadata":{"permalink":"/preview-docs/es/changelog/v1-7-3","source":"@site/i18n/es/docusaurus-plugin-content-blog-changelog/2024-11-14-V1.7.3.md","title":"Versi\xf3n 1.7.3","description":"14/11/2024","date":"2024-11-14T00:00:00.000Z","tags":[{"inline":true,"label":"release","permalink":"/preview-docs/es/changelog/tags/release"}],"hasTruncateMarker":true,"authors":[],"frontMatter":{"title":"Versi\xf3n 1.7.3","slug":"v1-7-3","date":"2024-11-14T00:00:00.000Z","tags":["release"]},"unlisted":false,"prevItem":{"title":"Versi\xf3n 1.7.4","permalink":"/preview-docs/es/changelog/v1-7-4"},"nextItem":{"title":"Versi\xf3n 1.7.2","permalink":"/preview-docs/es/changelog/v1-7-2"}},"content":"\x3c!--truncate--\x3e\\n\\n14/11/2024\\n\\n## Nuevas Funcionalidades\\n\\n- **Soporte para Oracle RDS (Beta):** Ahora puedes gestionar instancias Oracle RDS como dependencies dentro de SleakOps.\\n- **Soporte para Aurora PostgreSQL Serverless (Beta):** Agregada la capacidad de crear y gestionar bases de datos Aurora PostgreSQL Serverless.\\n\\n## Correcciones de Errores\\n\\n- Varias correcciones menores de errores."},{"id":"v1-7-2","metadata":{"permalink":"/preview-docs/es/changelog/v1-7-2","source":"@site/i18n/es/docusaurus-plugin-content-blog-changelog/2024-11-05-V1.7.2.md","title":"Versi\xf3n 1.7.2","description":"05/11/2024","date":"2024-11-05T00:00:00.000Z","tags":[{"inline":true,"label":"release","permalink":"/preview-docs/es/changelog/tags/release"}],"hasTruncateMarker":true,"authors":[],"frontMatter":{"title":"Versi\xf3n 1.7.2","slug":"v1-7-2","date":"2024-11-05T00:00:00.000Z","tags":["release"]},"unlisted":false,"prevItem":{"title":"Versi\xf3n 1.7.3","permalink":"/preview-docs/es/changelog/v1-7-3"},"nextItem":{"title":"Versi\xf3n 1.7.1","permalink":"/preview-docs/es/changelog/v1-7-1"}},"content":"\x3c!--truncate--\x3e\\n\\n05/11/2024\\n\\n## Nuevas Funcionalidades\\n\\n- **Eliminaci\xf3n de Bucket S3:** Introducida la capacidad de eliminar buckets S3 que contienen una gran cantidad de archivos.\\n- **VPN:** Actualizado el m\xf3dulo Pritunl a la \xfaltima versi\xf3n para mayor seguridad y rendimiento.\\n- **Mejoras en Gesti\xf3n de Suscripciones:** Mejorada la gesti\xf3n de suscripciones para una mejor experiencia de usuario.\\n- **Registro de Usuarios:** Habilitado el registro de nuevos usuarios en la plataforma.\\n\\n## Correcciones de Errores\\n\\n- Varias correcciones menores de errores."},{"id":"v1-7-1","metadata":{"permalink":"/preview-docs/es/changelog/v1-7-1","source":"@site/i18n/es/docusaurus-plugin-content-blog-changelog/2024-10-30-V1.7.1.md","title":"Versi\xf3n 1.7.1","description":"30/10/2024","date":"2024-10-30T00:00:00.000Z","tags":[{"inline":true,"label":"release","permalink":"/preview-docs/es/changelog/tags/release"}],"hasTruncateMarker":true,"authors":[],"frontMatter":{"title":"Versi\xf3n 1.7.1","slug":"v1-7-1","date":"2024-10-30T00:00:00.000Z","tags":["release"]},"unlisted":false,"prevItem":{"title":"Versi\xf3n 1.7.2","permalink":"/preview-docs/es/changelog/v1-7-2"},"nextItem":{"title":"Versi\xf3n 1.7.0","permalink":"/preview-docs/es/changelog/v1-7-0"}},"content":"\x3c!--truncate--\x3e\\n\\n30/10/2024\\n\\n## Nuevas Funcionalidades\\n\\n- **Creaci\xf3n de Environment y Dominio:** Mejorado el proceso para crear environments y dominios. Ahora puedes usar un dominio diferente al configurado globalmente sin limitaciones.\\n- **Notificaciones:** Agregado un sistema de notificaciones para informar a los usuarios sobre acciones manuales pendientes y actualizaciones de infraestructura programadas.\\n- **Documentaci\xf3n:** Actualizada documentaci\xf3n sobre gesti\xf3n de dominios, proyectos, dependencies y variables de entorno.\\n\\n## Correcciones de Errores\\n\\n- Varias correcciones menores de errores."},{"id":"v1-7-0","metadata":{"permalink":"/preview-docs/es/changelog/v1-7-0","source":"@site/i18n/es/docusaurus-plugin-content-blog-changelog/2024-10-14-V1.7.0.md","title":"Versi\xf3n 1.7.0","description":"14/10/2024","date":"2024-10-14T00:00:00.000Z","tags":[{"inline":true,"label":"release","permalink":"/preview-docs/es/changelog/tags/release"}],"hasTruncateMarker":true,"authors":[],"frontMatter":{"title":"Versi\xf3n 1.7.0","slug":"v1-7-0","date":"2024-10-14T00:00:00.000Z","tags":["release"]},"unlisted":false,"prevItem":{"title":"Versi\xf3n 1.7.1","permalink":"/preview-docs/es/changelog/v1-7-1"},"nextItem":{"title":"Versi\xf3n 1.6.3","permalink":"/preview-docs/es/changelog/v1-6-3"}},"content":"\x3c!--truncate--\x3e\\n\\n14/10/2024\\n\\n## Nuevas Funcionalidades\\n\\n- **Gesti\xf3n Avanzada de Nodos:** Introducida gesti\xf3n de node pools para proporcionar mayor control sobre los tipos de nodos donde se ejecutan los workloads.\\n- **Migraci\xf3n de M\xf3dulos de Cluster:** Todos los m\xf3dulos creados con el cluster ahora se ejecutan en instancias Graviton, mejorando el rendimiento y reduciendo costos.\\n- **Add-ons de Cluster:** Todos los add-ons ahora se ejecutan en instancias Graviton, mejorando a\xfan m\xe1s el rendimiento y reduciendo costos.\\n- **Nodos de Build Aislados:** Los builds ahora se ejecutan en nodos dedicados separados de los nodos de aplicaci\xf3n, mejorando la estabilidad de los nodos que ejecutan aplicaciones.\\n\\n## Correcciones de Errores\\n\\n- Varias correcciones menores de errores."},{"id":"v1-6-3","metadata":{"permalink":"/preview-docs/es/changelog/v1-6-3","source":"@site/i18n/es/docusaurus-plugin-content-blog-changelog/2024-09-27-V1.6.3.md","title":"Versi\xf3n 1.6.3","description":"27/09/2024","date":"2024-09-27T00:00:00.000Z","tags":[{"inline":true,"label":"release","permalink":"/preview-docs/es/changelog/tags/release"}],"hasTruncateMarker":true,"authors":[],"frontMatter":{"title":"Versi\xf3n 1.6.3","slug":"v1-6-3","date":"2024-09-27T00:00:00.000Z","tags":["release"]},"unlisted":false,"prevItem":{"title":"Versi\xf3n 1.7.0","permalink":"/preview-docs/es/changelog/v1-7-0"},"nextItem":{"title":"Versi\xf3n 1.6.2","permalink":"/preview-docs/es/changelog/v1-6-2"}},"content":"\x3c!--truncate--\x3e\\n\\n27/09/2024\\n\\n## Nuevas Funcionalidades\\n\\n- **Registro:** Implementado un nuevo flujo de registro.\\n\\n## Correcciones de Errores\\n\\n- Varias correcciones menores de errores y mejoras."},{"id":"v1-6-2","metadata":{"permalink":"/preview-docs/es/changelog/v1-6-2","source":"@site/i18n/es/docusaurus-plugin-content-blog-changelog/2024-09-19-V1.6.2.md","title":"Versi\xf3n 1.6.2","description":"19/09/2024","date":"2024-09-19T00:00:00.000Z","tags":[{"inline":true,"label":"release","permalink":"/preview-docs/es/changelog/tags/release"}],"hasTruncateMarker":true,"authors":[],"frontMatter":{"title":"Versi\xf3n 1.6.2","slug":"v1-6-2","date":"2024-09-19T00:00:00.000Z","tags":["release"]},"unlisted":false,"prevItem":{"title":"Versi\xf3n 1.6.3","permalink":"/preview-docs/es/changelog/v1-6-3"},"nextItem":{"title":"Versi\xf3n 1.6.1","permalink":"/preview-docs/es/changelog/v1-6-1"}},"content":"\x3c!--truncate--\x3e\\n\\n19/09/2024\\n\\n## Nuevas Funcionalidades\\n\\n- **Actualizaciones:** Actualizado **Prometheus**, **Loki**, y **EBS CSI Driver** a las \xfaltimas versiones a partir de agosto de 2024.\\n- **Migraci\xf3n de EBS CSI Driver:** SleakOps ahora usa el Addon EKS gestionado por AWS para el EBS CSI Driver, reemplazando la versi\xf3n auto-gestionada.\\n- **Prometheus y Loki con EBS:** Prometheus ahora utiliza vol\xfamenes EBS para persistencia de datos, previniendo p\xe9rdida de datos incluso si los pods fallan.\\n- **Loki con SimpleScalable:** Adopta una estructura **SimpleScalable** con almacenamiento **TSDB** para logs, mejorando el rendimiento.\\n- **Colas Dead-letter de SQS:** Ahora soporta la creaci\xf3n de **colas SQS** con colas dead-letter asociadas para mejor manejo de errores.\\n\\n## Correcciones de Errores\\n\\n- Varias correcciones menores de errores y mejoras en los flujos de workload de la plataforma."},{"id":"v1-6-1","metadata":{"permalink":"/preview-docs/es/changelog/v1-6-1","source":"@site/i18n/es/docusaurus-plugin-content-blog-changelog/2024-08-22-V1.6.1.md","title":"Versi\xf3n 1.6.1","description":"22/08/2024","date":"2024-08-22T00:00:00.000Z","tags":[{"inline":true,"label":"release","permalink":"/preview-docs/es/changelog/tags/release"}],"hasTruncateMarker":true,"authors":[],"frontMatter":{"title":"Versi\xf3n 1.6.1","slug":"v1-6-1","date":"2024-08-22T00:00:00.000Z","tags":["release"]},"unlisted":false,"prevItem":{"title":"Versi\xf3n 1.6.2","permalink":"/preview-docs/es/changelog/v1-6-2"},"nextItem":{"title":"Versi\xf3n 1.6.0","permalink":"/preview-docs/es/changelog/v1-6-0"}},"content":"\x3c!--truncate--\x3e\\n\\n22/08/2024\\n\\n## Nuevas Funcionalidades\\n\\n- **Actualizaciones de Versi\xf3n de Dependencies:** Actualizadas versiones de dependencies MQ, Elasticsearch, Memcache y Redis.\\n- **Mejoras en Autenticaci\xf3n:** Agregado soporte para almacenar tokens de autenticaci\xf3n v\xeda cookies en lugar de almacenamiento local.\\n- Agregada impresi\xf3n de registro de validaci\xf3n ACM en la pantalla de detalle de ACM, y el estado de ACM ahora est\xe1 incluido en el sistema.\\n\\n## Correcciones de Errores\\n\\n- Se han resuelto problemas con el flujo de provider."},{"id":"v1-6-0","metadata":{"permalink":"/preview-docs/es/changelog/v1-6-0","source":"@site/i18n/es/docusaurus-plugin-content-blog-changelog/2024-08-12-V1.6.0.md","title":"Versi\xf3n 1.6.0","description":"12/08/2024","date":"2024-08-12T00:00:00.000Z","tags":[{"inline":true,"label":"release","permalink":"/preview-docs/es/changelog/tags/release"}],"hasTruncateMarker":true,"authors":[],"frontMatter":{"title":"Versi\xf3n 1.6.0","slug":"v1-6-0","date":"2024-08-12T00:00:00.000Z","tags":["release"]},"unlisted":false,"prevItem":{"title":"Versi\xf3n 1.6.1","permalink":"/preview-docs/es/changelog/v1-6-1"},"nextItem":{"title":"Versi\xf3n 1.5.1","permalink":"/preview-docs/es/changelog/v1-5-1"}},"content":"\x3c!--truncate--\x3e\\n\\n12/08/2024\\n\\n## Nuevas Funcionalidades\\n\\n- **Soporte para Instancias ARM y Versiones Adicionales de RDS:** Agregadas instancias ARM y versiones extra en RDS.\\n- **EKS Actualizado a Versi\xf3n 1.29:** EKS ha sido actualizado a la versi\xf3n 1.29. Los changelogs de actualizaciones de EKS ahora se muestran.\\n- **Mejoras en Creaci\xf3n y Edici\xf3n de Provider:** Pantallas y campos para formularios de provider fueron actualizados, incluyendo cambios en estados y visualizaci\xf3n.\\n- **B\xfasqueda de Repositorio Mejorada:** Agregado soporte para b\xfasqueda as\xedncrona en el selector de repositorio y mejorada la funci\xf3n de b\xfasqueda para GitHub, GitLab y Bitbucket.\\n- **Parametrizaci\xf3n de Healthcheck:** Las propiedades de healthcheck ahora pueden parametrizarse con JSONSchema.\\n- **Nuevo Dashboard:** Se ha agregado un nuevo dashboard para ver consumo por namespace.\\n- Correcci\xf3n de un error al regenerar certificados, as\xed como problemas con builds que no se ejecutaban correctamente.\\n- Errores de frontend relacionados con listados y problemas de API que causaban errores de filtrado han sido corregidos.\\n\\n## Correcciones de Errores\\n\\n- Corregido un error al regenerar certificados, as\xed como problemas con builds que no se ejecutaban correctamente.\\n- Errores de frontend relacionados con listados y problemas de API que causaban errores de filtrado han sido corregidos."},{"id":"v1-5-1","metadata":{"permalink":"/preview-docs/es/changelog/v1-5-1","source":"@site/i18n/es/docusaurus-plugin-content-blog-changelog/2024-06-24-V1.5.1.md","title":"Versi\xf3n 1.5.1","description":"24/06/2024","date":"2024-06-24T00:00:00.000Z","tags":[{"inline":true,"label":"release","permalink":"/preview-docs/es/changelog/tags/release"}],"hasTruncateMarker":true,"authors":[],"frontMatter":{"title":"Versi\xf3n 1.5.1","slug":"v1-5-1","date":"2024-06-24T00:00:00.000Z","tags":["release"]},"unlisted":false,"prevItem":{"title":"Versi\xf3n 1.6.0","permalink":"/preview-docs/es/changelog/v1-6-0"},"nextItem":{"title":"Versi\xf3n 1.5.0","permalink":"/preview-docs/es/changelog/v1-5-0"}},"content":"\x3c!--truncate--\x3e\\n\\n24/06/2024\\n\\n## Nuevas Funcionalidades\\n\\n- **Configuraci\xf3n Avanzada de Recursos:** Se han implementado opciones avanzadas para configuraci\xf3n de recursos en environments de proyecto.\\n- **Optimizaci\xf3n de Scripts de Recolecci\xf3n de Datos:** Mejorada la eficiencia de scripts de recolecci\xf3n de datos para workload m\xe1s r\xe1pido.\\n\\n## Correcciones de Errores\\n\\n- Se han resuelto varios errores de interfaz que afectaban la usabilidad del sistema."},{"id":"v1-5-0","metadata":{"permalink":"/preview-docs/es/changelog/v1-5-0","source":"@site/i18n/es/docusaurus-plugin-content-blog-changelog/2024-05-23-V1.5.0.md","title":"Versi\xf3n 1.5.0","description":"23/05/2024","date":"2024-05-23T00:00:00.000Z","tags":[{"inline":true,"label":"release","permalink":"/preview-docs/es/changelog/tags/release"}],"hasTruncateMarker":true,"authors":[],"frontMatter":{"title":"Versi\xf3n 1.5.0","slug":"v1-5-0","date":"2024-05-23T00:00:00.000Z","tags":["release"]},"unlisted":false,"prevItem":{"title":"Versi\xf3n 1.5.1","permalink":"/preview-docs/es/changelog/v1-5-1"},"nextItem":{"title":"Versi\xf3n 1.4.3","permalink":"/preview-docs/es/changelog/v1-4-3"}},"content":"\x3c!--truncate--\x3e\\n\\n23/05/2024\\n\\n## Nuevas Funcionalidades\\n\\n- **Creaci\xf3n de M\xfaltiples Environments de Project:** Ahora puedes crear m\xfaltiples environments de proyecto usando el mismo repositorio y rama.\\n- **Validaci\xf3n de Dominio para Aliases:** Mejorada la validaci\xf3n de creaci\xf3n de dominio para aliases usando un ACM existente utilizable para ingress.\\n- **Configuraci\xf3n de Recursos en Project Env:** Agregada la capacidad de configurar recursos de build y deploy por environment de proyecto.\\n- **Configuraci\xf3n de Request de Deploy y Build:** Agregada la opci\xf3n de configurar requests de deploy y build en un ProjectEnv.\\n- **Dashboard de Grafana:** Se incorpor\xf3 un dashboard de Grafana para visualizar consumo por namespace.\\n- **Configuraci\xf3n de Loki:** Los logs ahora pueden buscarse por namespace con la nueva configuraci\xf3n de Loki.\\n- **Recolecci\xf3n de Datos:** Mejorado el script de recolecci\xf3n de facturaci\xf3n para ser idempotente y ejecutable para fechas espec\xedficas.\\n\\n## Correcciones de Errores\\n\\n- Corregido un error al crear dependencies S3 y resuelto un problema cr\xedtico con vargroups durante actualizaciones de apagado de cluster.\\n- Corregido un error cr\xedtico al invitar colaboradores."},{"id":"v1-4-3","metadata":{"permalink":"/preview-docs/es/changelog/v1-4-3","source":"@site/i18n/es/docusaurus-plugin-content-blog-changelog/2024-05-13-V1.4.3.md","title":"Versi\xf3n 1.4.3","description":"13/05/2024","date":"2024-05-13T00:00:00.000Z","tags":[{"inline":true,"label":"release","permalink":"/preview-docs/es/changelog/tags/release"}],"hasTruncateMarker":true,"authors":[],"frontMatter":{"title":"Versi\xf3n 1.4.3","slug":"v1-4-3","date":"2024-05-13T00:00:00.000Z","tags":["release"]},"unlisted":false,"prevItem":{"title":"Versi\xf3n 1.5.0","permalink":"/preview-docs/es/changelog/v1-5-0"},"nextItem":{"title":"Versi\xf3n 1.4.2","permalink":"/preview-docs/es/changelog/v1-4-2"}},"content":"\x3c!--truncate--\x3e\\n\\n13/05/2024\\n\\n## Nuevas Funcionalidades\\n\\n- **Mejoras en Gesti\xf3n de Dashboard:** Se mejor\xf3 la carga del dashboard, permitiendo que se visualice incluso si no hay cuenta seleccionada.\\n- **Mejoras en Pantallas de Facturaci\xf3n y Project:** Se realizaron mejoras en la pantalla de facturaci\xf3n, incluyendo una nueva secci\xf3n \\"otros\\" para contabilizar costos previamente no considerados. La pantalla de environment de proyecto tambi\xe9n fue mejorada.\\n- **Actualizaciones de Pol\xedticas:** La pol\xedtica de CloudFormation ha sido actualizada para mejorar gesti\xf3n y seguridad.\\n\\n## Correcciones de Errores\\n\\n- Corregido un error cr\xedtico que imped\xeda la creaci\xf3n de providers.\\n- Revisado y resuelto un problema relacionado con la integraci\xf3n de NewRelic.\\n- Corregido un problema con el refresh token al solicitar el URI de VPN.\\n- **Pantalla de Validaci\xf3n ACM y Errores de Logs de Builds:** Correcciones realizadas en la tabla de validaci\xf3n ACM y visualizaci\xf3n de logs para builds en estado de creaci\xf3n."},{"id":"v1-4-2","metadata":{"permalink":"/preview-docs/es/changelog/v1-4-2","source":"@site/i18n/es/docusaurus-plugin-content-blog-changelog/2024-04-25-V1.4.2.md","title":"Versi\xf3n 1.4.2","description":"25/04/2024","date":"2024-04-25T00:00:00.000Z","tags":[{"inline":true,"label":"release","permalink":"/preview-docs/es/changelog/tags/release"}],"hasTruncateMarker":true,"authors":[],"frontMatter":{"title":"Versi\xf3n 1.4.2","slug":"v1-4-2","date":"2024-04-25T00:00:00.000Z","tags":["release"]},"unlisted":false,"prevItem":{"title":"Versi\xf3n 1.4.3","permalink":"/preview-docs/es/changelog/v1-4-3"},"nextItem":{"title":"Versi\xf3n 1.4.1","permalink":"/preview-docs/es/changelog/v1-4-1"}},"content":"\x3c!--truncate--\x3e\\n\\n25/04/2024\\n\\n## Nuevas Funcionalidades\\n\\n- **Nuevas M\xe9tricas:** Agregadas nuevas m\xe9tricas para buckets S3 y RabbitMQ, mejorando el monitoreo de servicios. Tambi\xe9n se implement\xf3 un sistema de monitoreo de m\xe9tricas de OpenSearch.\\n- **Reorganizaci\xf3n de Esquema de Monitoreo:** Las estructuras de esquema de monitoreo fueron reorganizadas para mejor gesti\xf3n y visualizaci\xf3n. La pantalla de monitoreo de Dependencies ahora soporta diferentes tipos de recursos, proporcionando una vista m\xe1s detallada.\\n\\n## Correcciones de Errores\\n\\n- Se ha resuelto un problema cr\xedtico con vargroups, asegurando su funcionamiento adecuado."},{"id":"v1-4-1","metadata":{"permalink":"/preview-docs/es/changelog/v1-4-1","source":"@site/i18n/es/docusaurus-plugin-content-blog-changelog/2024-04-11-V1.4.1.md","title":"Versi\xf3n 1.4.1","description":"11/04/2024","date":"2024-04-11T00:00:00.000Z","tags":[{"inline":true,"label":"release","permalink":"/preview-docs/es/changelog/tags/release"}],"hasTruncateMarker":true,"authors":[],"frontMatter":{"title":"Versi\xf3n 1.4.1","slug":"v1-4-1","date":"2024-04-11T00:00:00.000Z","tags":["release"]},"unlisted":false,"prevItem":{"title":"Versi\xf3n 1.4.2","permalink":"/preview-docs/es/changelog/v1-4-2"},"nextItem":{"title":"Versi\xf3n 1.4.0","permalink":"/preview-docs/es/changelog/v1-4-0"}},"content":"\x3c!--truncate--\x3e\\n\\n11/04/2024\\n\\n## Nuevas Funcionalidades\\n\\n- **Monitoreo de Dependencies y OpenSearch:** Se cre\xf3 una nueva p\xe1gina de monitoreo para dependencies, facilitando el seguimiento de su estado. OpenSearch fue incluido.\\n- **Pol\xedtica de Ciclo de Vida de ECR:** Se configur\xf3 una pol\xedtica de ciclo de vida para ECR, mejorando la gesti\xf3n de im\xe1genes.\\n\\n## Correcciones de Errores\\n\\n- Corregido el problema de nombres duplicados entre cluster y nodo en Redis.\\n- Resueltos varios errores de frontend que afectaban la experiencia del usuario.\\n- Corregido el problema donde se mostraba un error al intentar publicar un vargroup sin un servicio asociado.\\n- Se corrigieron problemas al realizar m\xfaltiples deployments y releases consecutivos."},{"id":"v1-4-0","metadata":{"permalink":"/preview-docs/es/changelog/v1-4-0","source":"@site/i18n/es/docusaurus-plugin-content-blog-changelog/2024-03-06-V1.4.0.md","title":"Versi\xf3n 1.4.0","description":"06/03/2024","date":"2024-03-06T00:00:00.000Z","tags":[{"inline":true,"label":"release","permalink":"/preview-docs/es/changelog/tags/release"}],"hasTruncateMarker":true,"authors":[],"frontMatter":{"title":"Versi\xf3n 1.4.0","slug":"v1-4-0","date":"2024-03-06T00:00:00.000Z","tags":["release"]},"unlisted":false,"prevItem":{"title":"Versi\xf3n 1.4.1","permalink":"/preview-docs/es/changelog/v1-4-1"},"nextItem":{"title":"Versi\xf3n 1.3.0","permalink":"/preview-docs/es/changelog/v1-3-0"}},"content":"\x3c!--truncate--\x3e\\n\\n06/03/2024\\n\\n## Nuevas Funcionalidades\\n\\n- **Configuraci\xf3n de Grafana:** Se configur\xf3 la base de datos para el addon de Grafana, junto con DataSources y Dashboards.\\n- **Persistencia de M\xe9tricas de Prometheus con Thanos:** Agregado soporte para persistir m\xe9tricas de Prometheus usando Thanos.\\n- **Nueva API de Volumen:** Implementado soporte para la nueva API de volumen, mostrando estados y aplicando configuraci\xf3n para deployments.\\n- La opci\xf3n de actualizaci\xf3n en addons ha sido deshabilitada.\\n- Ahora, cuando se elimina una dependency, se crear\xe1 un deploy con \\"pending-approval\\" en lugar de uno autom\xe1tico.\\n\\n## Correcciones de Errores\\n\\n- Corregido un problema donde pre-hooks y nuevos vol\xfamenes se agregaban durante deploys, impidiendo que se generaran.\\n- Los subdominios ahora se marcan correctamente como delegados si los dominios padre ya est\xe1n delegados."},{"id":"v1-3-0","metadata":{"permalink":"/preview-docs/es/changelog/v1-3-0","source":"@site/i18n/es/docusaurus-plugin-content-blog-changelog/2024-03-01-V1.3.0.md","title":"Versi\xf3n 1.3.0","description":"01/03/2024","date":"2024-03-01T00:00:00.000Z","tags":[{"inline":true,"label":"release","permalink":"/preview-docs/es/changelog/tags/release"}],"hasTruncateMarker":true,"authors":[],"frontMatter":{"title":"Versi\xf3n 1.3.0","slug":"v1-3-0","date":"2024-03-01T00:00:00.000Z","tags":["release"]},"unlisted":false,"prevItem":{"title":"Versi\xf3n 1.4.0","permalink":"/preview-docs/es/changelog/v1-4-0"},"nextItem":{"title":"Versi\xf3n 1.2.4","permalink":"/preview-docs/es/changelog/v1-2-4"}},"content":"\x3c!--truncate--\x3e\\n\\n01/03/2024\\n\\n## Nuevas Funcionalidades\\n\\n- **Vista de Detalles de Project:** Una vista detallada de proyecto ahora est\xe1 disponible en la nueva interfaz.\\n- **API de M\xe9tricas RDS:** Se ha agregado una nueva API para mostrar m\xe9tricas RDS, mejorando la visibilidad de recursos.\\n- **LogViewer Mejorado:** La carga de LogViewer ahora es m\xe1s r\xe1pida y eficiente.\\n- **Onboarding Mejorado:** Se ha implementado un nuevo proceso de onboarding para facilitar la configuraci\xf3n.\\n- **Monitoreo de Redis:** Se ha agregado monitoreo de Redis, mejorando la supervisi\xf3n de infraestructura.\\n- **Configuraci\xf3n de R\xe9plica RDS:** Se ha agregado la opci\xf3n de configurar r\xe9plicas en la Dependency RDS para mayor flexibilidad.\\n- **Estado de Eliminaci\xf3n de Dominio:** La eliminaci\xf3n de dominio ahora crea un deploy con estado `pending-approval`, en lugar de un deploy autom\xe1tico.\\n- **Mejoras en Workload de Job:** El workload de Job ha sido mejorado, permitiendo reintentos autom\xe1ticos en caso de fallo inicial.\\n\\n## Correcciones de Errores\\n\\n- Se han resuelto problemas de integraci\xf3n con Bitbucket.\\n- Se han corregido problemas con valores indefinidos en Vargroups."},{"id":"v1-2-4","metadata":{"permalink":"/preview-docs/es/changelog/v1-2-4","source":"@site/i18n/es/docusaurus-plugin-content-blog-changelog/2024-02-15-V1.2.4.md","title":"Versi\xf3n 1.2.4","description":"15/02/2024","date":"2024-02-15T00:00:00.000Z","tags":[{"inline":true,"label":"release","permalink":"/preview-docs/es/changelog/tags/release"}],"hasTruncateMarker":true,"authors":[],"frontMatter":{"title":"Versi\xf3n 1.2.4","slug":"v1-2-4","date":"2024-02-15T00:00:00.000Z","tags":["release"]},"unlisted":false,"prevItem":{"title":"Versi\xf3n 1.3.0","permalink":"/preview-docs/es/changelog/v1-3-0"},"nextItem":{"title":"Versi\xf3n 1.2.3","permalink":"/preview-docs/es/changelog/v1-2-3"}},"content":"\x3c!--truncate--\x3e\\n\\n15/02/2024\\n\\n## Nuevas Funcionalidades\\n\\n- **Optimizaci\xf3n de Cluster Switcher:** El comportamiento del selector de cluster ha sido optimizado.\\n- **Login en Flujo de Suscripci\xf3n AWS:** El flujo de suscripci\xf3n AWS ahora incluye la capacidad de iniciar sesi\xf3n directamente.\\n\\n## Correcciones de Errores\\n\\n- Se han resuelto problemas de callback para integraciones Git y ruta de archivo Docker para GitLab.\\n- Se han corregido bugs menores relacionados con la pantalla de facturaci\xf3n."},{"id":"v1-2-3","metadata":{"permalink":"/preview-docs/es/changelog/v1-2-3","source":"@site/i18n/es/docusaurus-plugin-content-blog-changelog/2024-02-05-V1.2.3.md","title":"Versi\xf3n 1.2.3","description":"05/02/2024","date":"2024-02-05T00:00:00.000Z","tags":[{"inline":true,"label":"release","permalink":"/preview-docs/es/changelog/tags/release"}],"hasTruncateMarker":true,"authors":[],"frontMatter":{"title":"Versi\xf3n 1.2.3","slug":"v1-2-3","date":"2024-02-05T00:00:00.000Z","tags":["release"]},"unlisted":false,"prevItem":{"title":"Versi\xf3n 1.2.4","permalink":"/preview-docs/es/changelog/v1-2-4"},"nextItem":{"title":"Versi\xf3n 1.2.2","permalink":"/preview-docs/es/changelog/v1-2-2"}},"content":"\x3c!--truncate--\x3e\\n\\n05/02/2024\\n\\n## Nuevas Funcionalidades\\n\\n- **Desacoplamiento de Alias en Web Services:** La creaci\xf3n de aliases ahora est\xe1 separada del formulario de web services.\\n- **Restablecimiento de Contrase\xf1a IAM:** Ahora es posible restablecer la contrase\xf1a IAM para un usuario.\\n\\n## Correcciones de Errores\\n\\n- Se ha corregido un problema menor con tareas de release."},{"id":"v1-2-2","metadata":{"permalink":"/preview-docs/es/changelog/v1-2-2","source":"@site/i18n/es/docusaurus-plugin-content-blog-changelog/2024-01-25-V1.2.2.md","title":"Versi\xf3n 1.2.2","description":"25/01/2024","date":"2024-01-25T00:00:00.000Z","tags":[{"inline":true,"label":"release","permalink":"/preview-docs/es/changelog/tags/release"}],"hasTruncateMarker":true,"authors":[],"frontMatter":{"title":"Versi\xf3n 1.2.2","slug":"v1-2-2","date":"2024-01-25T00:00:00.000Z","tags":["release"]},"unlisted":false,"prevItem":{"title":"Versi\xf3n 1.2.3","permalink":"/preview-docs/es/changelog/v1-2-3"},"nextItem":{"title":"Versi\xf3n 1.2.1","permalink":"/preview-docs/es/changelog/v1-2-1"}},"content":"\x3c!--truncate--\x3e\\n\\n25/01/2024\\n\\n## Nuevas Funcionalidades\\n\\n- **Bot\xf3n de Validaci\xf3n de Dominio:** Se ha agregado un bot\xf3n \\"verificar validaci\xf3n\\" al drawer de dominio para facilitar la gesti\xf3n de dominios.\\n- **Tabla de Log de Actividad:** Se ha creado una tabla de log de actividad.\\n- **Encriptaci\xf3n de Access Keys:** Las access keys para proveedores de versi\xf3n de c\xf3digo (GIT) ahora est\xe1n encriptadas.\\n\\n## Correcciones de Errores\\n\\n- Se ha corregido un problema donde la API no recreaba correctamente el m\xf3dulo ACM durante la regeneraci\xf3n."},{"id":"v1-2-1","metadata":{"permalink":"/preview-docs/es/changelog/v1-2-1","source":"@site/i18n/es/docusaurus-plugin-content-blog-changelog/2024-01-12-V1.2.1.md","title":"Versi\xf3n 1.2.1","description":"12/01/2024","date":"2024-01-12T00:00:00.000Z","tags":[{"inline":true,"label":"release","permalink":"/preview-docs/es/changelog/tags/release"}],"hasTruncateMarker":true,"authors":[],"frontMatter":{"title":"Versi\xf3n 1.2.1","slug":"v1-2-1","date":"2024-01-12T00:00:00.000Z","tags":["release"]},"unlisted":false,"prevItem":{"title":"Versi\xf3n 1.2.2","permalink":"/preview-docs/es/changelog/v1-2-2"},"nextItem":{"title":"Versi\xf3n 1.2.0","permalink":"/preview-docs/es/changelog/v1-2-0"}},"content":"\x3c!--truncate--\x3e\\n\\n12/01/2024\\n\\n## Nuevas Funcionalidades\\n\\n- **Optimizaci\xf3n de Formulario de Vargroup:** Se han realizado mejoras de usabilidad en los formularios de Vargroup.\\n- **Eliminaci\xf3n de Provider y Cuenta de Usuario:** Eliminar un provider ahora tambi\xe9n elimina las cuentas de usuario asociadas.\\n\\n## Correcciones de Errores\\n\\n- Se ha corregido un bug en la regeneraci\xf3n de certificados ACM.\\n- Se ha corregido un problema de eliminaci\xf3n de provider."},{"id":"v1-2-0","metadata":{"permalink":"/preview-docs/es/changelog/v1-2-0","source":"@site/i18n/es/docusaurus-plugin-content-blog-changelog/2024-01-05-V1.2.0.md","title":"Versi\xf3n 1.2.0","description":"05/01/2024","date":"2024-01-05T00:00:00.000Z","tags":[{"inline":true,"label":"release","permalink":"/preview-docs/es/changelog/tags/release"}],"hasTruncateMarker":true,"authors":[],"frontMatter":{"title":"Versi\xf3n 1.2.0","slug":"v1-2-0","date":"2024-01-05T00:00:00.000Z","tags":["release"]},"unlisted":false,"prevItem":{"title":"Versi\xf3n 1.2.1","permalink":"/preview-docs/es/changelog/v1-2-1"},"nextItem":{"title":"Versi\xf3n 1.1.1","permalink":"/preview-docs/es/changelog/v1-1-1"}},"content":"\x3c!--truncate--\x3e\\n\\n05/01/2024\\n\\n## Nuevas Funcionalidades\\n\\n- **Logs en Grafana:** Se ha configurado una fuente de datos en Grafana para mostrar logs desde S3.\\n- **Bot\xf3n de Actualizaci\xf3n de Cluster:** Se ha agregado un bot\xf3n para permitir actualizaciones de cluster desde la interfaz.\\n- **Log de Actividad de Usuario:** Se ha creado un log de actividad para acciones de usuario.\\n- **Deploy de Validaci\xf3n de Dominio:** Ahora puedes crear un deploy que se ejecuta una vez que los dominios est\xe1n validados.\\n- **Autenticaci\xf3n de Dos Factores:** Se ha agregado autenticaci\xf3n de dos factores (2FA) al login para mayor seguridad.\\n\\n## Correcciones de Errores\\n\\n- Se ha corregido un problema con builds usando la misma rama que la predeterminada.\\n- Se ha mejorado la lectura de logs para procesamiento m\xe1s r\xe1pido.\\n- Se han realizado varias optimizaciones de frontend, incluyendo estilos, b\xfasqueda y visibilidad de recursos pendientes."},{"id":"v1-1-1","metadata":{"permalink":"/preview-docs/es/changelog/v1-1-1","source":"@site/i18n/es/docusaurus-plugin-content-blog-changelog/2023-12-05-V1.1.1.md","title":"Versi\xf3n 1.1.1","description":"05/12/2023","date":"2023-12-05T00:00:00.000Z","tags":[{"inline":true,"label":"release","permalink":"/preview-docs/es/changelog/tags/release"}],"hasTruncateMarker":true,"authors":[],"frontMatter":{"title":"Versi\xf3n 1.1.1","slug":"v1-1-1","date":"2023-12-05T00:00:00.000Z","tags":["release"]},"unlisted":false,"prevItem":{"title":"Versi\xf3n 1.2.0","permalink":"/preview-docs/es/changelog/v1-2-0"},"nextItem":{"title":"Versi\xf3n 1.1.0","permalink":"/preview-docs/es/changelog/v1-1-0"}},"content":"\x3c!--truncate--\x3e\\n\\n05/12/2023\\n\\n## Nuevas Funcionalidades\\n\\n- **Visor de Logs en Jobs:** Agregado un visor de logs en la lista de jobs, similar al que ya existe para deployments.\\n- **Dashboard v2:** Mejoras en la segunda versi\xf3n del Dashboard, con m\xe1s opciones y mejor organizaci\xf3n de informaci\xf3n.\\n- **Certificados de Cluster:** Los certificados de cluster ahora se eliminan y actualizan autom\xe1ticamente para prevenir problemas de expiraci\xf3n."},{"id":"v1-1-0","metadata":{"permalink":"/preview-docs/es/changelog/v1-1-0","source":"@site/i18n/es/docusaurus-plugin-content-blog-changelog/2023-11-06-V1.1.0.md","title":"Versi\xf3n 1.1.0","description":"06/11/2023","date":"2023-11-06T00:00:00.000Z","tags":[{"inline":true,"label":"release","permalink":"/preview-docs/es/changelog/tags/release"}],"hasTruncateMarker":true,"authors":[],"frontMatter":{"title":"Versi\xf3n 1.1.0","slug":"v1-1-0","date":"2023-11-06T00:00:00.000Z","tags":["release"]},"unlisted":false,"prevItem":{"title":"Versi\xf3n 1.1.1","permalink":"/preview-docs/es/changelog/v1-1-1"},"nextItem":{"title":"Versi\xf3n 1.0.5","permalink":"/preview-docs/es/changelog/v1-0-5"}},"content":"\x3c!--truncate--\x3e\\n\\n06/11/2023\\n\\n## Nuevas Funcionalidades\\n\\n- **Gesti\xf3n de Vargroups:** Agregada la opci\xf3n de mostrar vargroups en los formularios para servicios, workers, hooks y cronjobs.\\n- **Kubecost:** Integrado Kubecost con Prometheus-stack.\\n\\n## Correcciones de Errores\\n\\n- Resuelto el problema con Karpenter en instancias spot.\\n- Corregidos roles de usuario y edici\xf3n de usuarios.\\n- Corregidos problemas al eliminar un environment y la eliminaci\xf3n incorrecta de dominios.\\n- Corregido el error al intentar iniciar manualmente el cluster.\\n- Resuelto un error en la generaci\xf3n de hooks."},{"id":"v1-0-5","metadata":{"permalink":"/preview-docs/es/changelog/v1-0-5","source":"@site/i18n/es/docusaurus-plugin-content-blog-changelog/2023-10-27-V1.0.5.md","title":"Versi\xf3n 1.0.5","description":"27/10/2023","date":"2023-10-27T00:00:00.000Z","tags":[{"inline":true,"label":"release","permalink":"/preview-docs/es/changelog/tags/release"}],"hasTruncateMarker":true,"authors":[],"frontMatter":{"title":"Versi\xf3n 1.0.5","slug":"v1-0-5","date":"2023-10-27T00:00:00.000Z","tags":["release"]},"unlisted":false,"prevItem":{"title":"Versi\xf3n 1.1.0","permalink":"/preview-docs/es/changelog/v1-1-0"},"nextItem":{"title":"Versi\xf3n 1.0.4","permalink":"/preview-docs/es/changelog/v1-0-4"}},"content":"\x3c!--truncate--\x3e\\n\\n27/10/2023\\n\\n## Correcciones de Errores\\n\\n- Resueltos problemas de deployment y corregido Karpenter con instancias spot.\\n- Corregidos problemas al eliminar entidades y validar URLs de servicios."},{"id":"v1-0-4","metadata":{"permalink":"/preview-docs/es/changelog/v1-0-4","source":"@site/i18n/es/docusaurus-plugin-content-blog-changelog/2023-10-11-V1.0.4.md","title":"Versi\xf3n 1.0.4","description":"11/10/2023","date":"2023-10-11T00:00:00.000Z","tags":[{"inline":true,"label":"release","permalink":"/preview-docs/es/changelog/tags/release"}],"hasTruncateMarker":true,"authors":[],"frontMatter":{"title":"Versi\xf3n 1.0.4","slug":"v1-0-4","date":"2023-10-11T00:00:00.000Z","tags":["release"]},"unlisted":false,"prevItem":{"title":"Versi\xf3n 1.0.5","permalink":"/preview-docs/es/changelog/v1-0-5"},"nextItem":{"title":"Versi\xf3n 1.0.3","permalink":"/preview-docs/es/changelog/v1-0-3"}},"content":"\x3c!--truncate--\x3e\\n\\n11/10/2023\\n\\n## Nuevas Funcionalidades\\n\\n- **Refactorizaci\xf3n y Mejoras:** Refactorizado el dashboard y mejorada la visualizaci\xf3n de logs y la gesti\xf3n de eliminaci\xf3n de entidades.\\n\\n## Correcciones de Errores\\n\\n- Corregidos problemas de edici\xf3n de usuarios.\\n- Corregida la gesti\xf3n del estado del cluster.\\n- Resueltos problemas con dominios de environment.\\n- Corregido el manejo de errores en respuestas S3 con CloudFront."},{"id":"v1-0-3","metadata":{"permalink":"/preview-docs/es/changelog/v1-0-3","source":"@site/i18n/es/docusaurus-plugin-content-blog-changelog/2023-09-25-V1.0.3.md","title":"Versi\xf3n 1.0.3","description":"25/09/2023","date":"2023-09-25T00:00:00.000Z","tags":[{"inline":true,"label":"release","permalink":"/preview-docs/es/changelog/tags/release"}],"hasTruncateMarker":true,"authors":[],"frontMatter":{"title":"Versi\xf3n 1.0.3","slug":"v1-0-3","date":"2023-09-25T00:00:00.000Z","tags":["release"]},"unlisted":false,"prevItem":{"title":"Versi\xf3n 1.0.4","permalink":"/preview-docs/es/changelog/v1-0-4"},"nextItem":{"title":"Versi\xf3n 1.0.2","permalink":"/preview-docs/es/changelog/v1-0-2"}},"content":"\x3c!--truncate--\x3e\\n\\n25/09/2023\\n\\n## Nuevas Funcionalidades\\n\\n- **Botones de Gesti\xf3n y Mejoras en Formularios:** Agregados botones para gesti\xf3n de recursos y mejorados formularios de mapeo de variables.\\n- **Cronjobs y Regeneraci\xf3n de Dominio:** Ahora puedes detener o activar cronjobs y regenerar dominios.\\n\\n## Correcciones de Errores\\n\\n- Resuelto el problema de obtener el URI de VPN en Pritunl.\\n- Corregido el problema de selecci\xf3n de cuenta para usuarios viewer.\\n- Mejorado el manejo de informaci\xf3n de health check enviada al backend."},{"id":"v1-0-2","metadata":{"permalink":"/preview-docs/es/changelog/v1-0-2","source":"@site/i18n/es/docusaurus-plugin-content-blog-changelog/2023-09-04-V1.0.2.md","title":"Versi\xf3n 1.0.2","description":"04/09/2023","date":"2023-09-04T00:00:00.000Z","tags":[{"inline":true,"label":"release","permalink":"/preview-docs/es/changelog/tags/release"}],"hasTruncateMarker":true,"authors":[],"frontMatter":{"title":"Versi\xf3n 1.0.2","slug":"v1-0-2","date":"2023-09-04T00:00:00.000Z","tags":["release"]},"unlisted":false,"prevItem":{"title":"Versi\xf3n 1.0.3","permalink":"/preview-docs/es/changelog/v1-0-3"},"nextItem":{"title":"Versi\xf3n 1.0.1","permalink":"/preview-docs/es/changelog/v1-0-1"}},"content":"\x3c!--truncate--\x3e\\n\\n04/09/2023\\n\\n## Nuevas Funcionalidades\\n\\n- **Optimizaci\xf3n de Deployment:** Simplificado el proceso de deployment y edici\xf3n de environment de proyecto (ProjectEnv), facilitando configuraci\xf3n y deployment.\\n- **Ajustes de Recursos y Configuraci\xf3n:** Ahora puedes crear aliases personalizados para buckets.\\n- **Mejoras en Health Check:** La sonda de readiness para servicios en la cuenta de desarrollo ahora es opcional.\\n\\n## Correcciones de Errores\\n\\n- Resueltos problemas relacionados con VPN y configuraci\xf3n de par\xe1metros de seguridad."},{"id":"v1-0-1","metadata":{"permalink":"/preview-docs/es/changelog/v1-0-1","source":"@site/i18n/es/docusaurus-plugin-content-blog-changelog/2023-08-29-V1.0.1.md","title":"Versi\xf3n 1.0.1","description":"29/08/2023","date":"2023-08-29T00:00:00.000Z","tags":[{"inline":true,"label":"release","permalink":"/preview-docs/es/changelog/tags/release"}],"hasTruncateMarker":true,"authors":[],"frontMatter":{"title":"Versi\xf3n 1.0.1","slug":"v1-0-1","date":"2023-08-29T00:00:00.000Z","tags":["release"]},"unlisted":false,"prevItem":{"title":"Versi\xf3n 1.0.2","permalink":"/preview-docs/es/changelog/v1-0-2"},"nextItem":{"title":"Versi\xf3n 1.0.0","permalink":"/preview-docs/es/changelog/v1-0-0"}},"content":"\x3c!--truncate--\x3e\\n\\n29/08/2023\\n\\n## Nuevas Funcionalidades\\n\\n- **Gesti\xf3n de Suscripciones:** El login y actualizaciones de token se controlan seg\xfan el estado de la suscripci\xf3n. Adicionalmente, se implement\xf3 una nueva API para registrar usuarios y empresas, validando suscripciones pendientes, con un nuevo modelo para mejor gesti\xf3n de suscripciones, integrando AwsClient.\\n- **Onboarding de Marketplace:** Proceso simplificado para crear usuarios que vienen de un marketplace."},{"id":"v1-0-0","metadata":{"permalink":"/preview-docs/es/changelog/v1-0-0","source":"@site/i18n/es/docusaurus-plugin-content-blog-changelog/2023-08-23-V1.0.0.md","title":"Versi\xf3n 1.0.0","description":"23/08/2023","date":"2023-08-23T00:00:00.000Z","tags":[{"inline":true,"label":"release","permalink":"/preview-docs/es/changelog/tags/release"}],"hasTruncateMarker":true,"authors":[],"frontMatter":{"title":"Versi\xf3n 1.0.0","slug":"v1-0-0","date":"2023-08-23T00:00:00.000Z","tags":["release"]},"unlisted":false,"prevItem":{"title":"Versi\xf3n 1.0.1","permalink":"/preview-docs/es/changelog/v1-0-1"}},"content":"\x3c!--truncate--\x3e\\n\\n23/08/2023\\n\\n## Nuevas Funcionalidades\\n\\n- **Configuraci\xf3n de Vol\xfamenes:** Ahora puedes configurar vol\xfamenes en environments de proyecto directamente desde el formulario.\\n- **Apagado Nocturno con Zona Horaria:** Agregado soporte para seleccionar zonas horarias en el apagado nocturno.\\n- **Inicio Manual de Cluster:** Nuevo bot\xf3n para iniciar clusters manualmente.\\n- **Integraci\xf3n con CloudFront:** Soporte para usar CloudFront para mejorar la entrega de contenido.\\n- **Backups Autom\xe1ticos:** Puedes configurar backups autom\xe1ticos para dependencies.\\n- **Instancias Graviton:** Soporte para usar instancias Graviton en nodos.\\n- **Encriptaci\xf3n:** Implementada encriptaci\xf3n en StackSettings para mayor seguridad.\\n\\n## Correcciones de Errores\\n\\n- Resuelto un problema en la API de facturaci\xf3n y estimaci\xf3n de costos.\\n- Corregidos errores al eliminar Providers y VPNs.\\n- Ahora puedes eliminar certificados ACM usados por un Load Balancer sin problemas."}]}}')}}]);